id,institutionCode,collectionCode,ownerInstitutionCode,basisOfRecord,occurrenceID,catalogNumber,otherCatalogNumbers,kingdom,phylum,class,order,family,scientificName,taxonID,scientificNameAuthorship,genus,specificEpithet,taxonRank,infraspecificEpithet,identifiedBy,dateIdentified,identificationReferences,identificationRemarks,taxonRemarks,identificationQualifier,typeStatus,recordedBy,recordedByID,associatedCollectors,recordNumber,eventDate,year,month,day,startDayOfYear,endDayOfYear,verbatimEventDate,occurrenceRemarks,habitat,substrate,verbatimAttributes,fieldNumber,informationWithheld,dataGeneralizations,dynamicProperties,associatedTaxa,reproductiveCondition,establishmentMeans,cultivationStatus,lifeStage,sex,individualCount,samplingProtocol,samplingEffort,preparations,country,stateProvince,county,municipality,locality,locationRemarks,localitySecurity,localitySecurityReason,decimalLatitude,decimalLongitude,geodeticDatum,coordinateUncertaintyInMeters,verbatimCoordinates,georeferencedBy,georeferenceProtocol,georeferenceSources,georeferenceVerificationStatus,georeferenceRemarks,minimumElevationInMeters,maximumElevationInMeters,minimumDepthInMeters,maximumDepthInMeters,verbatimDepth,verbatimElevation,disposition,language,genericcolumn1,genericcolumn2,storageLocation,observerUid,processingStatus,duplicateQuantity,recordEnteredBy,dateEntered,dateLastModified,modified,sourcePrimaryKey-dbpk,recordId,references
174333,BOL,1,,Preserved specimen,,215715,215715,Plantae,Bryophyta,Bryopsida,Bartramiales,Orthotrichaceae,Macromitrium hariotii,117562,Besch. ex Mull.Hal.,Macromitrium,hariotii,,,"Allen, B",2017-0-0,,,,,,"Allen, B",,,26717,1/24/2004,2004,1,24,24,,,,On soil in hummock on Cape.,,,,,,,,,,0,,,,,,,CHILE,Chile South,,,Magallanes,"Antartica Chilena: Comuna Cabo de Hornos. Islas Wollaston. Horn Island, between Caleta San Leon & Punta Espelon. <26701 - 26730>. (55",0,,-55.962778,-67.224167,,,,,,,,,120,120,,,,,,,,,,,unprocessed,,admin,,7/8/2022 14:07,11/16/2021 0:00,,urn:uuid:f6263364-247c-4b84-a900-4c642f79b18e,http://test.adu.org.za/symbiota/collections/individual/index.php?occid=174333
174317,BOL,1,,Preserved specimen,,215699,215699,Plantae,Bryophyta,Bryopsida,Dicranales,Dicranaceae,Dicranoloma imponens,117492,(Mont.) Renauld,Dicranoloma,imponens,,,"Klazenga, N",2016-0-0,,,,,,"Allen, B",,,26613,1/22/2004,2004,1,22,22,,,,On ground. Grass-rush area with ponds & small lakes; wet coastal Nothofagus forest. <26578 - 26630).,,,,,,,,,,0,,,,,,,CHILE,Chile South,,,Magallanes,"Antartica Chilena: Comuna Cabo de Hornos. Hoste Island. Hardy Peninsula, Bahia Orange, Caleta Misiones. (55",0,,-55.521667,-68.096944,,,,,,,,,0,50,,,,,,,,,,,unprocessed,,admin,,7/8/2022 14:07,11/16/2021 0:00,,urn:uuid:4dc0e219-b637-469d-9592-0562f4f89ac6,http://test.adu.org.za/symbiota/collections/individual/index.php?occid=174317
174318,BOL,1,,Preserved specimen,,215700,215700,Plantae,Bryophyta,Bryopsida,Dicranales,Dicranaceae,Dicranoloma robustum,117493,(Hook.f. & Wilson) Paris,Dicranoloma,robustum,,,"Klazenga, N",2016-0-0,,,,,,"Allen, B",,,26190,1/15/2004,2004,1,15,15,,,,,,,,,,,,,,0,,,,,,,CHILE,Chile South,,,Magallanes,"Antartica Chilena: Comuna Cabo de Hornos. Isla Grande de la Tierra del Fuego, west shore of Seno Ventisqueros between first & second narrows. <26187 - 26230>. (54",0,,-54.781667,-70.319444,,,,,,,,,0,100,,,,,,,,,,,unprocessed,,admin,,7/8/2022 14:07,11/16/2021 0:00,,urn:uuid:d75497ff-15dc-43fa-a401-7b4e33e6403b,http://test.adu.org.za/symbiota/collections/individual/index.php?occid=174318
174335,BOL,1,,Preserved specimen,174335,215717,215717,Plantae,Bryophyta,Bryopsida,Dicranales,Dicranaceae,Dicranoloma billardieri,34731,(Brid.) Paris,Dicranoloma,billardieri,,,"Klazenga, N",2016-0-0,,,,,,"Allen, B",,,26195,1/15/2004,2004,1,15,,,,,,,,,,,,,,,0,,,,,,,CHILE,Chile South,,,Magallanes,"Antartica Chilena: Comuna Cabo de Hornos. Isla Grande de la Tierra del Fuego, west shore of Seno Ventisqueros between first & second narrows. <26187 - 26230>. (54",0,,-54.781667,-70.319444,,,,,,,,,0,100,,,,,,,,,,,unprocessed,,admin,,11/16/2021 14:22,11/16/2021 14:22,,urn:uuid:6dee9ae7-28c1-4379-9c9d-b526fd87ada6,http://test.adu.org.za/symbiota/collections/individual/index.php?occid=174335
174332,BOL,1,,Preserved specimen,174332,215714,215714,Plantae,Bryophyta,Bryopsida,Dicranales,Dicranaceae,Dicranoloma billardieri,34731,(Brid.) Paris,Dicranoloma,billardieri,,,"Klazenga, N",2016-0-0,,,,,,"Allen, B",,,26144,1/15/2004,2004,1,15,,,,,Low shrubs & grasses with dwarf Nothofagus. <26142 - 26186>.,,,,,,,,,,0,,,,,,,CHILE,Chile South,,,Magallanes,Antartica Chilena: Comuna Cabo de Hornos. E side of London Island. (54,0,,-54.674722,-71.945,,,,,,,,,0,100,,,,,,,,,,,unprocessed,,admin,,11/16/2021 14:22,11/16/2021 14:22,,urn:uuid:c9693520-e2fc-475c-a144-8c0d18191007,http://test.adu.org.za/symbiota/collections/individual/index.php?occid=174332
136376,BOL,1,,Preserved specimen,136376,BOL150031,150031,Chromista,Ochrophyta,Phaeophyceae,Laminariales,Laminariaceae,Macrocystis laevis,,C.H.Hay,,,,,Cameron H. Hay,1983-4-0,,,,,Type,"Hay, CH; C.H.",,,BH 32323,9/18/1979,1979,9,18,,,,,"Substrate: Rock. Tide Level or depth: 8-10m below L.w. Wave exp.: moderate. Occurrence: abundant. [Sheet 1 of 5. Sheet 2: BOL150032, Sheet 3: BOL150033, Sheet 4: BOL150034, Sheet 5: BOL150035]",,,,,,,,,,0,,,,,,,TVL,,,,,"Transvaal Cove, Marion Island.",0,,-46.875,37.8675,,,,,,,,,0,0,,,,,,,,,,,unprocessed,,admin,,11/16/2021 14:22,11/16/2021 14:22,,urn:uuid:04b82988-85c2-4014-8e74-24253e1a8a51,http://test.adu.org.za/symbiota/collections/individual/index.php?occid=136376
136377,BOL,1,,Preserved specimen,136377,BOL150032,150032,Chromista,Ochrophyta,Phaeophyceae,Laminariales,Laminariaceae,Macrocystis laevis,,C.H.Hay,,,,,Cameron H. Hay,1983-4-0,,,,,Type,"Hay, CH",,,BH 32323,9/18/1979,1979,9,18,,,,,"Substrate: Rock. Tide Level or depth: 8-10m below L.w. Wave exp.: moderate. Occurrence: abundant. [Sheet 2 of 5. Sheet 1: BOL150031, Sheet 3: BOL150033, Sheet 4: BOL150034, Sheet 5: BOL150035]",,,,,,,,,,0,,,,,,,TVL,,,,,"Transvaal Cove, Marion Island.",0,,-46.875,37.8675,,,,,,,,,0,0,,,,,,,,,,,unprocessed,,admin,,11/16/2021 14:22,11/16/2021 14:22,,urn:uuid:2527288f-8108-42e5-be17-3f699c42d452,http://test.adu.org.za/symbiota/collections/individual/index.php?occid=136377
136378,BOL,1,,Preserved specimen,136378,BOL150033,150033,Chromista,Ochrophyta,Phaeophyceae,Laminariales,Laminariaceae,Macrocystis laevis,,C.H.Hay,,,,,Cameron H. Hay,1983-4-0,,,,,Type,"Hay, CH",,,BH 32323,9/18/1979,1979,9,18,,,,,"Substrate: Rock. Tide Level or depth: 8-10m below L.w. Wave exp.: moderate. Occurrence: abundant. [Sheet 3 of 5. Sheet 1: BOL150031, Sheet 2: BOL150032, Sheet 4: BOL150034, Sheet 5: BOL150035]",,,,,,,,,,0,,,,,,,TVL,,,,,"Transvaal Cove, Marion Island.",0,,-46.875,37.8675,,,,,,,,,0,0,,,,,,,,,,,unprocessed,,admin,,11/16/2021 14:22,11/16/2021 14:22,,urn:uuid:2bd0344b-a3d8-455a-95db-3a4377c95d55,http://test.adu.org.za/symbiota/collections/individual/index.php?occid=136378
136379,BOL,1,,Preserved specimen,136379,BOL150034,150034,Chromista,Ochrophyta,Phaeophyceae,Laminariales,Laminariaceae,Macrocystis laevis,,C.H.Hay,,,,,Cameron H. Hay,1983-4-0,,,,,Type,"Hay, CH",,,BH 32323,9/18/1979,1979,9,18,,,,,"Substrate: Rock. Tide Level or depth: 8-10m below L.w. Wave exp.: moderate. Occurrence: abundant. [Sheet 4 of 5. Sheet 1: BOL150031, Sheet 2: BOL150032, Sheet 3: BOL150033, Sheet 5: BOL150035]",,,,,,,,,,0,,,,,,,TVL,,,,,"Transvaal Cove, Marion Island.",0,,-46.875,37.8675,,,,,,,,,0,0,,,,,,,,,,,unprocessed,,admin,,11/16/2021 14:22,11/16/2021 14:22,,urn:uuid:a16021dd-4112-46aa-bce8-ba1321827ff2,http://test.adu.org.za/symbiota/collections/individual/index.php?occid=136379
136380,BOL,1,,Preserved specimen,136380,BOL150035,150035,Chromista,Ochrophyta,Phaeophyceae,Laminariales,Laminariaceae,Macrocystis laevis,,C.H.Hay,,,,,Cameron H. Hay,1983-4-0,,,,,Type,"Hay, CH; C.H.",,,BH 32323,9/18/1979,1979,9,18,,,,,"Substrate: Rock. Tide Level or depth: 8-10m below L.w. Wave exp.: moderate. Occurrence: abundant. [Sheet 5 of 5. Sheet 1: BOL150031, Sheet 2: BOL150032, Sheet 3: BOL150033, Sheet 4: BOL150034]",,,,,,,,,,0,,,,,,,TVL,,,,,"Transvaal Cove, Marion Island.",0,,-46.875,37.8675,,,,,,,,,0,0,,,,,,,,,,,unprocessed,,admin,,11/16/2021 14:22,11/16/2021 14:22,,urn:uuid:63ce737b-9641-43bb-8f03-d55083cbe688,http://test.adu.org.za/symbiota/collections/individual/index.php?occid=136380
174331,BOL,1,,Preserved specimen,174331,215713,215713,Plantae,Bryophyta,Bryopsida,Dicranales,Dicranaceae,Dicranoloma billardieri,34731,(Brid.) Paris,Dicranoloma,billardieri,,,"Klazenga, N",2016-0-0,,,,,,"Crosby, M.R.",,,12569,2/7/1976,1976,2,7,,,,,On rotting log.,,,,,,,,,,0,,,,,,,CHILE,Chile South,,,Chilo,"Los Lagos: Cocauque area, across Estero Yaldad from village of Yaldad, Isla Chiloe. (43",0,,-43.116667,-73.733333,,,,,,,,,0,0,,,,,,,,,,,unprocessed,,admin,,6/14/2022 15:06,6/14/2022 15:06,,urn:uuid:4456d901-a480-4b9f-8132-0968536f77c5,http://test.adu.org.za/symbiota/collections/individual/index.php?occid=174331
174297,BOL,1,,Preserved specimen,,215679,215679,Plantae,Bryophyta,Bryopsida,Dicranales,Dicranaceae,Dicranoloma chilense,117491,(De Not.) Ochyra & Matteri,Dicranoloma,chilense,,,"Klazenga, N",2016-0-0,,,,,,"Crosby, M.R.",,,12607,2/10/1976,1976,2,10,41,,,,Terrestrial.,,,,,,,,,,0,,,,,,,CHILE,Chile South,,,,"Los Lagos Region: Forest (mostly Drimys, Laurelia & Berberis) E of Cucao near SW end of Lago Cucao, Loncomilla (Alto de la Virgen), Isla Chilo",0,,-42.65,-74.1,,,,,,,,,75,75,,,,,,,,,,,unprocessed,,admin,,7/8/2022 14:07,6/14/2022 0:00,,urn:uuid:7e6be3b2-7c90-47e1-a571-875ae015c237,http://test.adu.org.za/symbiota/collections/individual/index.php?occid=174297
174334,BOL,1,,Preserved specimen,174334,215716,215716,Plantae,Bryophyta,Bryopsida,Dicranales,Dicranaceae,Dicranoloma billardieri,34731,(Brid.) Paris,Dicranoloma,billardieri,,,"Klazenga, N",2016-0-0,,,,,,"Crosby, M.R.",,,12392a,2/4/1976,1976,2,4,,,,,Tree base.,,,,,,,,,,0,,,,,,,CHILE,Chile South,,,Chilo,"Los Lagos: Forest at Butalcura, near Rio Butalcura, 11 km by road from Ruta 5, Cordillera San Pedro, Isla Chiloe. (42",0,,-42.233333,-73.75,,,,,,,,,100,100,,,,,,,,,,,unprocessed,,admin,,6/14/2022 15:06,6/14/2022 15:06,,urn:uuid:c2c984be-f62f-4041-afa2-a99f8bf73fdf,http://test.adu.org.za/symbiota/collections/individual/index.php?occid=174334
174305,BOL,1,,Preserved specimen,174305,215687,215687,Plantae,Bryophyta,Bryopsida,Dicranales,Dicranaceae,Dicranoloma billardieri,34731,(Brid.) Paris,Dicranoloma,billardieri,,,"Klazenga, N",2016-0-0,,,,,,"Crosby, M.R.",,,12371,2/3/1976,1976,2,3,,,,,On tree.,,,,,,,,,,0,,,,,,,CHILE,Chile South,,,Chilo,"Los Lagos: Forest at Chepu, S side of Rio Chepu, Isla Chiloe. (42",0,,-42.05,-74.033333,,,,,,,,,0,0,,,,,,,,,,,unprocessed,,admin,,6/14/2022 15:06,6/14/2022 15:06,,urn:uuid:2acd647e-63bb-4789-98e6-ddb7a1ec5938,http://test.adu.org.za/symbiota/collections/individual/index.php?occid=174305
174289,BOL,1,,Preserved specimen,,207570,207570,Plantae,Bryophyta,Bryopsida,Dicranales,Dicranaceae,Dicranoloma robustum,117493,(Hook.f. & Wilson) Paris,Dicranoloma,robustum,,,"Klazenga, N",2016-0-0,,,,,,"Crosby, M.R.",,,12060,1/27/1976,1976,1,27,27,,,,On tree base.,,,,,,,,,,0,,,,,,,CHILE,Chile South,,,Osorno,"Los Lagos Region: Forest at Aqua Caliente, near falls, along Rio Chanleufu, 4 km from Termas de Puyehue along road to Refugio Antillanca. (40",0,,-41.201853,-72.559258,,,,,,,,,400,400,,,,,,,,,,,unprocessed,,admin,,7/8/2022 14:07,6/14/2022 0:00,,urn:uuid:e70ba71e-7334-43f7-9482-4c5f59d4c2be,http://test.adu.org.za/symbiota/collections/individual/index.php?occid=174289
174310,BOL,1,,Preserved specimen,,215692,215692,Plantae,Bryophyta,Bryopsida,Bartramiales,Bartramiaceae,Bartramia mossmaniana,117463,Mull.Hal.,Bartramia,mossmaniana,,,"Buck, WR",2016-0-0,,,,,,"Crosby, M.R.",,,12063,1/27/1976,1976,1,27,27,,,,On tree base.,,,,,,,,,,0,,,,,,,CHILE,Chile South,,,Osorno,"Los Lagos: Forest at Agua Caliente, near falls, along Rio Chanleufu, 4 km from Termas de Puyehue along road to Refugio Antillanca. (40",0,,-40.716667,-72.333333,,,,,,,,,400,400,,,,,,,,,,,unprocessed,,admin,,7/8/2022 14:07,6/14/2022 0:00,,urn:uuid:c69639c2-1722-476b-b48b-8adb458d3e30,http://test.adu.org.za/symbiota/collections/individual/index.php?occid=174310
174319,BOL,1,,Preserved specimen,174319,215701,215701,Plantae,Bryophyta,Andreaeopsida,Andreaeales,Andreaeaceae,Andreaea subulata,37717,Harv.,Andreaea,subulata,,,"Allen, B",2016-0-0,,,,,,"Crosby, M.R.",,,12837,2/18/1976,1976,2,18,,,,,On exposed rock.,,,,,,,,,,0,,,,,,,CHILE,Chile South,,,Valdivia,"Los Lagos: Forest on W slope of Cordillera Pelada, 6.2 km by road Wof El Mirador on road between La Union & Punta Hueicolla. (40",0,,-40.116667,-73.6,,,,,,,,,680,680,,,,,,,,,,,unprocessed,,admin,,6/14/2022 15:06,6/14/2022 15:06,,urn:uuid:b86db496-e593-4583-924e-fdc57dc97c85,http://test.adu.org.za/symbiota/collections/individual/index.php?occid=174319
174311,BOL,1,,Preserved specimen,,215693,215693,Plantae,Bryophyta,Bryopsida,Bartramiales,Bartramiaceae,Bartramia mossmaniana,117463,Mull.Hal.,Bartramia,mossmaniana,,,"Buck, WR",2016-0-0,,,,,,"Crosby, M.R.",,,11786,1/18/1976,1976,1,18,18,,,,On rotting wood.,,,,,,,,,,0,,,,,,,CHILE,Chile South,,,Valdivia,"Los Lagos: Forest on southwest slope of Volcan Quetrupillan, Forestal Trafan. (39",0,,-39.566667,-71.783333,,,,,,,,,1100,1100,,,,,,,,,,,unprocessed,,admin,,7/8/2022 14:07,6/14/2022 0:00,,urn:uuid:553869fc-aae8-44b7-9e19-7aaa6ceaeb4a,http://test.adu.org.za/symbiota/collections/individual/index.php?occid=174311
174295,BOL,1,,Preserved specimen,174295,215677,215677,Plantae,Bryophyta,Bryopsida,Dicranales,Dicranaceae,Platyneuron praealtum,35717,(Mitt.) Ochyra & Bednarek-Ochyra,Platyneuron,praealtum,,,"Allen, B",2017-0-0,,,,,,"Crosby, M.R.",,,11723,1/18/1976,1976,1,18,,,,,"Alpine-subalpine w/Nothofagus pumilio, stream & late melt snow. Terrestrial.",,,,,,,,,,0,,,,,,,CHILE,Chile South,,,Valdivia,"Los Lagos Region: Immediately SW of Laguna Los Patos, SW slope of Volcan Quetrupill",0,,-39.5,-71.7,,,,,,,,,1450,1600,,,,,,,,,,,unprocessed,,admin,,6/14/2022 15:06,6/14/2022 15:06,,urn:uuid:9a807faf-e174-401b-9a8c-41783e6c9d02,http://test.adu.org.za/symbiota/collections/individual/index.php?occid=174295
174296,BOL,1,,Preserved specimen,174296,215678,215678,Plantae,Bryophyta,Bryopsida,Dicranales,Dicranaceae,Dicranoloma billardieri,34731,(Brid.) Paris,Dicranoloma,billardieri,,,"Klazenga, N",2016-0-0,,,,,,"Crosby, M.R.",,,11472,1/8/1976,1976,1,8,,,,,"Terrestrial, near stream.",,,,,,,,,,0,,,,,,,CHILE,Chile South,,,Los Lagos,"Forest on E-facing slope of southern portion of Cordillera de Queule, just N of Rio El Lingue. (39",0,,-39.433333,-73.1,,,,,,,,,90,90,,,,,,,,,,,unprocessed,,admin,,6/14/2022 15:06,6/14/2022 15:06,,urn:uuid:9b6b3319-d22d-4b93-9ac7-b06b06cedcbc,http://test.adu.org.za/symbiota/collections/individual/index.php?occid=174296
174294,BOL,1,,Preserved specimen,174294,215676,215676,Plantae,Bryophyta,Bryopsida,Hypnales,Amblystegiaceae,Vittia pachyloma,38449,(Mont.) Ochyra,Vittia,pachyloma,,,"Allen, B",2016-0-0,,,,,,"Crosby, M.R.",,,11895,1/21/1976,1976,1,21,,,,,"On rocks, in river.",,,,,,,,,,0,,,,,,,CHILE,Chile South,,,Araucania,"Cautin. Forested rather narrow gorge at Salto Palguin, 6.7 km along road to Termas de Palguin. (39",0,,-39.366667,-71.733333,,,,,,,,,580,580,,,,,,,,,,,unprocessed,,admin,,6/14/2022 15:06,6/14/2022 15:06,,urn:uuid:91d55188-4fe4-49ae-967a-bd25606509a2,http://test.adu.org.za/symbiota/collections/individual/index.php?occid=174294
173987,BOL,1,,Preserved specimen,173987,203553,203553,Plantae,Spermatophyta,Monocots,Poales,Cyperaceae,Lepidosperma filiforme,,Labill.,,,,,,,,,,,,"Wilson, K.L.",,"Wilson, A",10509,1/2/2009,2009,1,2,,,,,"Open heathy area on ridge-line, surrounded by low sclerophyll forest.",,,,,,,,,,0,,,,,,,AUSTRALIA,Victoria,,,Croajingolong N.P.,"West Wingan Road, 14.6 km NW of Wingan Inlet camping area, c. 19 km SE from Princes Highway. (37",0,,-37.691389,149.4325,,,,,,,,,10,10,,,,,,,,,,,unprocessed,,admin,,6/27/2022 13:40,6/27/2022 13:40,,urn:uuid:82855035-414c-4442-a87d-4bee963167e8,http://test.adu.org.za/symbiota/collections/individual/index.php?occid=173987
176230,BOL,1,,Preserved specimen,176230,BOL217687,217687,Plantae,Spermatophyta,Eudicots,Caryophyllales,Aizoaceae,Tetragonia tetragonoides,,(Pall.) Kuntze,,,,,,,,,,,,"Davis, R",,,12537,4/16/2015,2015,4,16,,,,,Grey sand dunes. Coastal scrub.,,"Prostate herb, 25 cm high x 1 m wide. Flowers yellow.",,,,,,,,0,,,,,,,AUSTRALIA,Western Australia,Albany,,Quaramup Road,,0,,-35.074722,117.927778,,,35° 4' 29.00' S. 117° 55' 40.00' E,,,,,,0,0,,,,,,,,,,,unprocessed,,admin,,6/13/2022 9:54,6/13/2022 9:54,,urn:uuid:6a923c7f-c41c-4b9e-b018-039e549b2f1c,http://test.adu.org.za/symbiota/collections/individual/index.php?occid=176230
157365,BOL,1,,Preserved specimen,157365,171201,171201,Plantae,Spermatophyta,Eudicots,Caryophyllales,Aizoaceae,Tetragonia implexicoma,,(Miq.) Hook.f.,,,,,,,,,,,,"Davis, R",,,12538,4/16/2015,2015,4,16,,,,,Grey- white sand dune. Coastal scrub. Occasional.,,"Sprawling shrub, 40cm high x 1.2m wide. Flowers yellow.",,,,,,,,0,,,,,,,AUSTRALIA,Western Australia,Albany,,,Quaramup Road.,0,,-35.071944,117.928333,,,35° 4' 19.000' S. 117° 55' 42.000' E,,,,,,0,0,,,,,,,,,,,unprocessed,,admin,,1/20/2022 12:02,1/20/2022 12:02,,urn:uuid:fda37582-ed20-4a42-a9dd-1f8ba2cc2802,http://test.adu.org.za/symbiota/collections/individual/index.php?occid=157365
174843,BOL,1,,Preserved specimen,174843,216225,216225,Plantae,Spermatophyta,Eudicots,Caryophyllales,Aizoaceae,Tetragonia decumbens,49379,Mill.,Tetragonia,decumbens,,,,,,,,,,"Davis, R",,,12539,4/16/2015,2015,4,16,,,,,Grey-white sand dune. Coastal scrub.,,"Prostrate perennial herb, 20 cm high x 80 cm wide. Flowers yellow.",,,,,,,,0,,,,,,,AUSTRALIA,Western Australia,Albany,,Quaramup Road,,0,,-35.071944,117.928333,,,35° 4' 19.000' S. 117° 55' 42.000' E,,,,,,0,0,,,,,,,,,,,unprocessed,,admin,,6/10/2022 13:22,6/10/2022 13:22,,urn:uuid:9dd68325-144f-4681-8f26-7ceb580a6373,http://test.adu.org.za/symbiota/collections/individual/index.php?occid=174843
175288,BOL,1,,Preserved specimen,175288,216671,216671,Plantae,Spermatophyta,Monocots,Poales,Restionaceae,Chordifex abortivus,,(Nees) B.G.Briggs & L.A.S.Johnson,,,,,"Briggs, BG",1998-2-0,,,,,,"Briggs, B.G.",,"Johnson, L.A.S.; Meney, K.; Linder, H.P.; Pate, J.",8702,9/13/1990,1990,9,13,,,,(This specimen is a duplicate of NSW 233041).,Slight depression; shrubland. Deep pale grey sand.,,"Tufted, large clumps to 15 cm across at base. Female.",,,,,,,,0,,,,,,,AUSTRALIA,New South Wales,Sydney,,WA Eyre,"C. 48 km ENE of Albany; Cheyne Beach Road, 13.3 km SE of Hassell Road.",0,,-34.866667,118.366667,,,34° 52' S. 118° 22' E,,,,,,0,0,,,,,,,,,,,unprocessed,,admin,,7/28/2022 12:44,7/28/2022 12:44,,urn:uuid:1d0694bc-1672-45e9-b625-849e33979b8d,http://test.adu.org.za/symbiota/collections/individual/index.php?occid=175288
175280,BOL,1,,Preserved specimen,175280,216663,216663,Plantae,Spermatophyta,Monocots,Poales,Restionaceae,Chordifex isomorphus,,(K.W.Dixon & Meney) L.A.S.Johnson & B.G.Briggs,,,,,,,,,,,,"Briggs, B.G.",,"Meney, K.A.",9067,10/13/1992,1992,10,13,,,,(This specimen is a duplicate of NSW 261661).,Flat site. Restiad swamp with scattered trees. Roadside drain. Clay with laterite gravel.,,Female.,,,,,,,,0,,,,,,,AUSTRALIA,New South Wales,Sydney,,WA Darling,"Govenor Broome Rd, 3.5 km W of Dennis Rd junction.",0,,-34.233333,115.233333,,,34° 14' S. 115° 14' E,,,,,,0,0,,,,,,,,,,,unprocessed,,admin,,7/28/2022 15:00,7/28/2022 15:00,,urn:uuid:52f0a559-cde2-4786-b6e4-fe4a18a52cac,http://test.adu.org.za/symbiota/collections/individual/index.php?occid=175280
175285,BOL,1,,Preserved specimen,175285,216668,216668,Plantae,Spermatophyta,Monocots,Poales,Restionaceae,Chordifex isomorphus,,(K.W.Dixon & Meney) L.A.S.Johnson & B.G.Briggs,,,,,,,,,,,,"Briggs, B.G.",,"Meney, K.A.",9066,10/13/1992,1992,10,13,,,,(This specimen is a duplicate of NSW 261660).,Flat site. Restiad swamp with scattered trees. Roadside drain. Clay with laterite gravel. With Megalotheca magna.,,Male.,,,,,,,,0,,,,,,,AUSTRALIA,New South Wales,Sydney,,WA Darling,"Governor Broome Rd, 3.5 km W of Dennis Rd junction.",0,,-34.233333,115.233333,,,34° 14' S. 115° 14' E,,,,,,0,0,,,,,,,,,,,unprocessed,,admin,,7/28/2022 15:00,7/28/2022 15:00,,urn:uuid:49b58dbb-74a4-4c6a-a8ee-3c6472a205bb,http://test.adu.org.za/symbiota/collections/individual/index.php?occid=175285
175287,BOL,1,,Preserved specimen,175287,216670,216670,Plantae,Spermatophyta,Monocots,Poales,Restionaceae,Lepyrodia heleocharoides,,Gilg,,,,,,,,,,,,"Briggs, B.G.",,"Johnson, L.A.S.; Meney, K.; Linder, H.P.; Pate, J.",8671,9/11/1990,1990,9,11,,,,(This specimen is a duplicate of NSW 232882).,Wet scrub-heath. Sand over ironstone pavement.,,Male.,,,,,,,,0,,,,,,,AUSTRALIA,New South Wales,Sydney,,WA Darling,"1.1 km E of Scott River Road, on Govenor Broome Road; c. 16 km ENE of Augusta.",0,,-34.233333,115.266667,,,34° 14' S. 115° 16' E,,,,,,0,0,,,,,,,,,,,unprocessed,,admin,,7/28/2022 12:44,7/28/2022 12:44,,urn:uuid:7abcbc08-63b6-43b3-a492-55c546c51632,http://test.adu.org.za/symbiota/collections/individual/index.php?occid=175287
133978,BOL,1,,Preserved specimen,,147617,147617,Plantae,Chlorophyta,Ulvophyceae,Ulvales,Ulvaceae,Ulva capensis,109321,Aresch.,Ulva,capensis,,,,,,,,,,"Purcell, M.",,,s.n.,,,,,,,,,,,,,,,,,,,0,,,,,,,South Africa,Western Cape,,,,Witsands,0,,-34.10222,23.4,,,,,,,,,0,0,,,,,,,,,,,unprocessed,,admin,,8/5/2022 13:03,11/16/2021 0:00,,urn:uuid:5a96ed5d-3aef-4300-80bf-d6b1b2d9bdf3,http://test.adu.org.za/symbiota/collections/individual/index.php?occid=133978
133061,BOL,1,,Preserved specimen,,146690,146690,Plantae,Chlorophyta,Ulvophyceae,Cladophorales,Cladophoraceae,Cladophora radiosa,73577,(Suhr) Kutz.,Cladophora,radiosa,,,,,,,,,,SANPAD 2000,,,s.n.,,,,,,,,,,,,,,,,,,,0,,,,,,,South Africa,Western Cape,,,,Buffelsbaai Walker Point (Goukamma),0,,-34.08333,23,,,,,,,,,0,0,,,,,,,,,,,unprocessed,,admin,,8/5/2022 13:03,11/16/2021 0:00,,urn:uuid:f14872aa-5f9d-474b-a4f3-62c5c9aab829,http://test.adu.org.za/symbiota/collections/individual/index.php?occid=133061
133350,BOL,1,,Preserved specimen,,146982,146982,Plantae,Chlorophyta,Ulvophyceae,Bryopsidales,Codiaceae,Codium lucasii subsp. capense,29458,P.C.Silva,Codium,lucasii,subsp.,capense,,,,,,,,SANPAD 2000,,,s.n.,,,,,,,,,,,,,,,,,,,0,,,,,,,South Africa,Western Cape,,,,Buffelsbaai Walker Point (Goukamma),0,,-34.08333,23,,,,,,,,,0,0,,,,,,,,,,,unprocessed,,admin,,8/5/2022 13:03,11/16/2021 0:00,,urn:uuid:58fc4f17-1fca-40db-acc7-3090e54c659b,http://test.adu.org.za/symbiota/collections/individual/index.php?occid=133350
133516,BOL,1,,Preserved specimen,133516,147150,147150,Plantae,Chlorophyta,Ulvophyceae,Bryopsidales,Codiaceae,Codium stephensiae,26572,C.I.Dickinson,Codium,stephensiae,,,,,,,,,,SANPAD 2000,,,s.n.,,,,,,,,,,,,,,,,,,,0,,,,,,,South Africa,Western Cape,,,,Buffelsbaai  Walker Point (Goukamma),0,,-34.08333,23,,,,,,,,,0,0,,,,,,,,,,,unprocessed,,admin,,8/5/2022 13:03,8/5/2022 13:03,,urn:uuid:e8a90888-7de8-44dd-97a2-73d82a01cb97,http://test.adu.org.za/symbiota/collections/individual/index.php?occid=133516
134102,BOL,1,,Preserved specimen,,147742,147742,Plantae,Chlorophyta,Ulvophyceae,Ulvales,Ulvaceae,Ulva spathulata,117368,Papenf.,Ulva,spathulata,,,,,,,,,,SANPAD 2000,,,s.n.,,,,,,,,,,,,,,,,,,,0,,,,,,,South Africa,Western Cape,,,,Buffelsbaai Walker Point (Goukamma),0,,-34.08333,23,,,,,,,,,0,0,,,,,,,,,,,unprocessed,,admin,,8/5/2022 13:03,11/16/2021 0:00,,urn:uuid:bfa72bed-1a57-41ca-9826-1d7a3c56f5d5,http://test.adu.org.za/symbiota/collections/individual/index.php?occid=134102
134103,BOL,1,,Preserved specimen,,147743,147743,Plantae,Chlorophyta,Ulvophyceae,Ulvales,Ulvaceae,Ulva spathulata,117368,Papenf.,Ulva,spathulata,,,,,,,,,,"Bolton, J.J.",,SANPAD,s.n.,,,,,,,,,,,,,,,,,,,0,,,,,,,South Africa,Western Cape,,,,Buffelsbaai Rowwerhoek (Goukamma),0,,-34.08333,23,,,,,,,,,0,0,,,,,,,,,,,unprocessed,,admin,,8/5/2022 13:03,11/16/2021 0:00,,urn:uuid:4029585c-bd8f-4e4d-9d76-6084f06f743c,http://test.adu.org.za/symbiota/collections/individual/index.php?occid=134103
133477,BOL,1,,Preserved specimen,,147111,147111,Plantae,Chlorophyta,Ulvophyceae,Bryopsidales,Codiaceae,Codium tenue,26573,(Kutz.) Kutz.,Codium,tenue,,,,,,,,,,"Duthie, A.V.",,,s.n.,,,,,,,,,,,,,,,,,,,0,,,,,,,South Africa,Western Cape,,,,Knysna,0,,-34.08333,23.06667,,,,,,,,,0,0,,,,,,,,,,,unprocessed,,admin,,8/5/2022 13:03,11/16/2021 0:00,,urn:uuid:14576d7e-e403-4905-ad18-b099a7e92a39,http://test.adu.org.za/symbiota/collections/individual/index.php?occid=133477
133479,BOL,1,,Preserved specimen,,147113,147113,Plantae,Chlorophyta,Ulvophyceae,Bryopsidales,Codiaceae,Codium tenue,26573,(Kutz.) Kutz.,Codium,tenue,,,,,,,,,,Unknown,,,s.n.,,,,,,,,,,,,,,,,,,,0,,,,,,,South Africa,Western Cape,,,,Knysna,0,,-34.08333,23.06667,,,,,,,,,0,0,,,,,,,,,,,unprocessed,,admin,,8/5/2022 13:03,11/16/2021 0:00,,urn:uuid:4d668d30-f924-4408-8ac7-2d15c53803a2,http://test.adu.org.za/symbiota/collections/individual/index.php?occid=133479
134247,BOL,1,,Preserved specimen,,147887,147887,Plantae,Chlorophyta,Ulvophyceae,Ulvales,Ulvaceae,Ulva,33856,,,,,,,,,,,,,"Isaac, W.E.",,,s.n.,,,,,,,,,,,,,,,,,,,0,,,,,,,South Africa,Western Cape,,,,Knysna,0,,-34.08333,23.06667,,,,,,,,,0,0,,,,,,,,,,,unprocessed,,admin,,8/5/2022 13:03,11/16/2021 0:00,,urn:uuid:4bc4be72-4910-4a84-a306-b0b5e4b118ed,http://test.adu.org.za/symbiota/collections/individual/index.php?occid=134247
134943,BOL,1,,Preserved specimen,,148591,148591,Plantae,Rhodophyta,Florideophyceae,Ceramiales,Ceramiaceae,Spyridia cupressina,,Kutzing,,,,,,,,,,,,"Isaac, W.E.",,,I 285,1/4/1953,1953,1,4,4,,,,,,,,,,,,,,0,,,,,,,South Africa,Western Cape,,,3418BA,Mnandi,0,,-34.07583,18.61944,,,,,,,,,0,0,,,,,,,,,,,unprocessed,,admin,,9/13/2022 16:46,8/5/2022 0:00,,urn:uuid:6c5f7265-26e2-4047-a7c2-71e12b6a3c9b,http://test.adu.org.za/symbiota/collections/individual/index.php?occid=134943
132586,BOL,1,,Preserved specimen,,146198,146198,Plantae,Chlorophyta,Ulvophyceae,Bryopsidales,Caulerpaceae,Caulerpa filiformis,26429,(Suhr) K.Hering,Caulerpa,filiformis,,,,,,,,,,"Isaac, W.E.",,,s.n.,,,,,,,,,,,,,,,,,,,0,,,,,,,South Africa,Western Cape,,,,Tergniet,0,,-34.06944,22.2,,,,,,,,,0,0,,,,,,,,,,,unprocessed,,admin,,8/5/2022 13:03,11/16/2021 0:00,,urn:uuid:2e7d214b-92c8-4557-a847-cf9dcdeabbc1,http://test.adu.org.za/symbiota/collections/individual/index.php?occid=132586
133259,BOL,1,,Preserved specimen,133259,146890,146890,Plantae,Chlorophyta,Ulvophyceae,Bryopsidales,Codiaceae,Codium duthieae,26560,P.C.Silva,Codium,duthieae,,,,,,,,,,"Isaac, W.E.",,,s.n.,,,,,,,,,,,,,,,,,,,0,,,,,,,South Africa,Western Cape,,,,Tergniet,0,,-34.06944,22.2,,,,,,,,,0,0,,,,,,,,,,,unprocessed,,admin,,8/5/2022 13:03,8/5/2022 13:03,,urn:uuid:11a0ce34-ab6f-4aaa-a05d-bb0087081e96,http://test.adu.org.za/symbiota/collections/individual/index.php?occid=133259
134245,BOL,1,,Preserved specimen,,147885,147885,Plantae,Chlorophyta,Ulvophyceae,Ulvales,Ulvaceae,Ulva,33856,,,,,,,,,,,,,"Isaac, W.E.",,,s.n.,,,,,,,,,,,,,,,,,,,0,,,,,,,South Africa,Western Cape,,,,Beacon Island Plettenberg Bay,0,,-34.06667,23.38333,,,,,,,,,0,0,,,,,,,,,,,unprocessed,,admin,,8/5/2022 13:03,11/16/2021 0:00,,urn:uuid:809693db-81e4-4787-951e-b4070031e714,http://test.adu.org.za/symbiota/collections/individual/index.php?occid=134245
13936,BOL,1,,Preserved specimen,13936,15188,15188,,,,,Rhizophyllidaceae,Portieria hornemannii,,(Lyngbye) P.C.Silva,,,,,,,,,,,,"Sinton, S",,"Green, R.",Simons 433,7/8/1971,1971,7,8,,,,,,,,,,,,,,,0,,,,,,,South Africa,Western Cape,,,,"Herolds Bay, George",0,,-34.05695,22.4,,,,,,,,,0,0,,,,,,,,,,,unprocessed,,admin,,8/5/2022 13:03,8/5/2022 13:03,,urn:uuid:82c20d75-e539-450c-8aaa-ff7323cd6676,http://test.adu.org.za/symbiota/collections/individual/index.php?occid=13936
20515,BOL,1,,Preserved specimen,,21910,21910,Plantae,Rhodophyta,Florideophyceae,Ceramiales,Rhodomelaceae,Laurencia flexuosa,117250,Kutz.,Laurencia,flexuosa,,,,,,,,,,"Home, HB",,,s.n.,1892-01-01,1892,1,1,1,,,,,,,,,,,,,,0,,,,,,,South Africa,Western Cape,,,,Plettenberg Bay,0,,-34.05,23.38056,,,,,,,,,0,0,,,,,,,,,,,unprocessed,,admin,,8/5/2022 13:03,11/16/2021 0:00,,urn:uuid:babbbda2-e61b-45fe-8c43-d1d78c5d6009,http://test.adu.org.za/symbiota/collections/individual/index.php?occid=20515
20555,BOL,1,,Preserved specimen,,21951,21951,Plantae,Rhodophyta,Florideophyceae,Ceramiales,Rhodomelaceae,Laurencia glomerata,117251,(Kutz.) Kutz.,Laurencia,glomerata,,,,,,,,,,"Home, HB",,,s.n.,1892-01-01,1892,1,1,1,,,,,,,,,,,,,,0,,,,,,,South Africa,Western Cape,,,,Plettenberg Bay,0,,-34.05,23.38056,,,,,,,,,0,0,,,,,,,,,,,unprocessed,,admin,,8/5/2022 13:03,11/16/2021 0:00,,urn:uuid:812604a7-e261-4f30-b74c-ac701f3f23fd,http://test.adu.org.za/symbiota/collections/individual/index.php?occid=20555
133110,BOL,1,,Preserved specimen,,146739,146739,Plantae,Chlorophyta,Ulvophyceae,Cladophorales,Cladophoraceae,Cladophora,33651,,,,,,,,,,,,,SANPAD 2000,,,s.n.,,,,,,,,,,,,,,,,,,,0,,,,,,,South Africa,Western Cape,,,,Knysna Lagoon,0,,-34.04167,23.04167,,,,,,,,,0,0,,,,,,,,,,,unprocessed,,admin,,8/5/2022 13:03,11/16/2021 0:00,,urn:uuid:cae79828-f2de-4eeb-866d-da27d217622d,http://test.adu.org.za/symbiota/collections/individual/index.php?occid=133110
133476,BOL,1,,Preserved specimen,,147110,147110,Plantae,Chlorophyta,Ulvophyceae,Bryopsidales,Codiaceae,Codium tenue,26573,(Kutz.) Kutz.,Codium,tenue,,,,,,,,,,SANPAD 2000,,,s.n.,,,,,,,,,,,,,,,,,,,0,,,,,,,South Africa,Western Cape,,,,Knysna Lagoon,0,,-34.04167,23.04167,,,,,,,,,0,0,,,,,,,,,,,unprocessed,,admin,,8/5/2022 13:03,11/16/2021 0:00,,urn:uuid:c52c336b-9b54-4f3a-adf6-5fb3cb46479e,http://test.adu.org.za/symbiota/collections/individual/index.php?occid=133476
133613,BOL,1,,Preserved specimen,,147247,147247,Plantae,Chlorophyta,Ulvophyceae,Bryopsidales,Derbesiaceae,Derbesia,33663,,,,,,,,,,,,,SANPAD 2000,,,s.n.,,,,,,,,,,,,,,,,,,,0,,,,,,,South Africa,Western Cape,,,,Knysna Lagoon,0,,-34.04167,23.04167,,,,,,,,,0,0,,,,,,,,,,,unprocessed,,admin,,8/5/2022 13:03,11/16/2021 0:00,,urn:uuid:33d9b22d-c1ac-438b-9b93-528865bf07f3,http://test.adu.org.za/symbiota/collections/individual/index.php?occid=133613
133709,BOL,1,,Preserved specimen,,147345,147345,Plantae,Chlorophyta,Ulvophyceae,Ulvales,Ulvaceae,Enteromorpha linziformis,117355,Bliding,Enteromorpha,linziformis,,,,,,,,,,SANPAD 2000,,,s.n.,,,,,,,,,,,,,,,,,,,0,,,,,,,South Africa,Western Cape,,,,Knysna Lagoon,0,,-34.04167,23.04167,,,,,,,,,0,0,,,,,,,,,,,unprocessed,,admin,,8/5/2022 13:03,11/16/2021 0:00,,urn:uuid:99d9b94e-5c08-45e8-99c2-dc8181f5e0c5,http://test.adu.org.za/symbiota/collections/individual/index.php?occid=133709
133712,BOL,1,,Preserved specimen,,147348,147348,Plantae,Chlorophyta,Ulvophyceae,Ulvales,Ulvaceae,Enteromorpha muscoides,117357,(Clemente) Cremades,Enteromorpha,muscoides,,,,,,,,,,SANPAD 2000,,,s.n.,,,,,,,,,,,,,,,,,,,0,,,,,,,South Africa,Western Cape,,,,Knysna Lagoon,0,,-34.04167,23.04167,,,,,,,,,0,0,,,,,,,,,,,unprocessed,,admin,,8/5/2022 13:03,11/16/2021 0:00,,urn:uuid:cbcf168f-aa0a-4ad9-9cd7-b7586e9e3bd1,http://test.adu.org.za/symbiota/collections/individual/index.php?occid=133712
133908,BOL,1,,Preserved specimen,,147547,147547,Plantae,Chlorophyta,Ulvophyceae,Cladophorales,Cladophoraceae,Rhizoclonium riparium,38258,(Roth) Harv.,Rhizoclonium,riparium,,,,,,,,,,SANPAD 2000,,,s.n.,,,,,,,,,,,,,,,,,,,0,,,,,,,South Africa,Western Cape,,,,Knysna Lagoon,0,,-34.04167,23.04167,,,,,,,,,0,0,,,,,,,,,,,unprocessed,,admin,,8/5/2022 13:03,11/16/2021 0:00,,urn:uuid:82694340-2d79-4122-8e93-b82708c91733,http://test.adu.org.za/symbiota/collections/individual/index.php?occid=133908
134082,BOL,1,,Preserved specimen,,147722,147722,Plantae,Chlorophyta,Ulvophyceae,Ulvales,Ulvaceae,Ulva rhacodes,38439,(Holmes) Papenf.,Ulva,rhacodes,,,,,,,,,,SANPAD 2000,,,s.n.,,,,,,,,,,,,,,,,,,,0,,,,,,,South Africa,Western Cape,,,,Knysna Lagoon,0,,-34.04167,23.04167,,,,,,,,,0,0,,,,,,,,,,,unprocessed,,admin,,8/5/2022 13:03,11/16/2021 0:00,,urn:uuid:12dd5786-a976-45c9-99cf-0cac4e0fa3b5,http://test.adu.org.za/symbiota/collections/individual/index.php?occid=134082
134098,BOL,1,,Preserved specimen,,147738,147738,Plantae,Chlorophyta,Ulvophyceae,Ulvales,Ulvaceae,Ulva rigida,38440,C.Agardh,Ulva,rigida,,,,,,,,cf.,,SANPAD 2000,,,s.n.,,,,,,,,,,,,,,,,,,,0,,,,,,,South Africa,Western Cape,,,,Knysna Lagoon,0,,-34.04167,23.04167,,,,,,,,,0,0,,,,,,,,,,,unprocessed,,admin,,8/5/2022 13:03,11/16/2021 0:00,,urn:uuid:85f70616-ab34-4fc6-9456-60f9f021a2ee,http://test.adu.org.za/symbiota/collections/individual/index.php?occid=134098
134238,BOL,1,,Preserved specimen,,147878,147878,Plantae,Chlorophyta,Ulvophyceae,Ulvales,Ulvaceae,Ulva,33856,,,,,,,,,,,,,SANPAD 2000,,,s.n.,,,,,,,,,,,,,,,,,,,0,,,,,,,South Africa,Western Cape,,,,Knysna Lagoon,0,,-34.04167,23.04167,,,,,,,,,0,0,,,,,,,,,,,unprocessed,,admin,,8/5/2022 13:03,11/16/2021 0:00,,urn:uuid:1111dbf4-8c4c-46e1-9860-f9ab681ec9dc,http://test.adu.org.za/symbiota/collections/individual/index.php?occid=134238
132335,BOL,1,,Preserved specimen,,145943,145943,Plantae,Chlorophyta,Ulvophyceae,Bryopsidales,Bryopsidaceae,Bryopsis africana,37827,Aresch.,Bryopsis,africana,,,,,,,,,,SANPAD 2000,,,s.n.,,,,,,,,,,,,,,,,,,,0,,,,,,,South Africa,Western Cape,,,,Goukamma Marine Reserve,0,,-34.03333,22.95,,,,,,,,,0,0,,,,,,,,,,,unprocessed,,admin,,8/5/2022 13:03,11/16/2021 0:00,,urn:uuid:8006e901-8a8e-48cf-b41d-ab8b2fa2139e,http://test.adu.org.za/symbiota/collections/individual/index.php?occid=132335
132336,BOL,1,,Preserved specimen,,145944,145944,Plantae,Chlorophyta,Ulvophyceae,Bryopsidales,Bryopsidaceae,Bryopsis africana,37827,Aresch.,Bryopsis,africana,,,,,,,,,,SANPAD 2000,,,s.n.,,,,,,,,,,,,,,,,,,,0,,,,,,,South Africa,Western Cape,,,,Goukamma Marine Reserve,0,,-34.03333,22.95,,,,,,,,,0,0,,,,,,,,,,,unprocessed,,admin,,8/5/2022 13:03,11/16/2021 0:00,,urn:uuid:be5985d7-6b07-4bc6-b518-ede355ba753b,http://test.adu.org.za/symbiota/collections/individual/index.php?occid=132336
132511,BOL,1,,Preserved specimen,,146122,146122,Plantae,Chlorophyta,Ulvophyceae,Bryopsidales,Caulerpaceae,Caulerpa filiformis,26429,(Suhr) K.Hering,Caulerpa,filiformis,,,,,,,,,,SANPAD 2000,,,s.n.,,,,,,,,,,,,,,,,,,,0,,,,,,,South Africa,Western Cape,,,,Goukamma Marine Reserve,0,,-34.03333,22.95,,,,,,,,,0,0,,,,,,,,,,,unprocessed,,admin,,8/5/2022 13:03,11/16/2021 0:00,,urn:uuid:62d8f6f5-f62d-4aed-8131-07a7ceee27f4,http://test.adu.org.za/symbiota/collections/individual/index.php?occid=132511
132512,BOL,1,,Preserved specimen,,146123,146123,Plantae,Chlorophyta,Ulvophyceae,Bryopsidales,Caulerpaceae,Caulerpa filiformis,26429,(Suhr) K.Hering,Caulerpa,filiformis,,,,,,,,,,SANPAD 2000,,,s.n.,,,,,,,,,,,,,,,,,,,0,,,,,,,South Africa,Western Cape,,,,Goukamma Marine Reserve,0,,-34.03333,22.95,,,,,,,,,0,0,,,,,,,,,,,unprocessed,,admin,,8/5/2022 13:03,11/16/2021 0:00,,urn:uuid:13e444bb-6a18-4e5f-a614-bf4fb29df65f,http://test.adu.org.za/symbiota/collections/individual/index.php?occid=132512
132801,BOL,1,,Preserved specimen,132801,146416,146416,Plantae,Chlorophyta,Ulvophyceae,Cladophorales,Cladophoraceae,Chaetomorpha spiralis,37884,Okamura,Chaetomorpha,spiralis,,,,,,,,,,SANPAD 2000,,,s.n.,,,,,,,,,,,,,,,,,,,0,,,,,,,South Africa,Western Cape,,,,Goukamma Marine Reserve,0,,-34.03333,22.95,,,,,,,,,0,0,,,,,,,,,,,unprocessed,,admin,,8/5/2022 13:03,8/5/2022 13:03,,urn:uuid:2a524d47-ae57-4d5a-964b-ff2c516fb5f9,http://test.adu.org.za/symbiota/collections/individual/index.php?occid=132801
133062,BOL,1,,Preserved specimen,,146691,146691,Plantae,Chlorophyta,Ulvophyceae,Cladophorales,Cladophoraceae,Cladophora radiosa,73577,(Suhr) Kutz.,Cladophora,radiosa,,,,,,,,,,SANPAD 2000,,,s.n.,,,,,,,,,,,,,,,,,,,0,,,,,,,South Africa,Western Cape,,,,Goukamma Marine Reserve,0,,-34.03333,22.95,,,,,,,,,0,0,,,,,,,,,,,unprocessed,,admin,,8/5/2022 13:03,11/16/2021 0:00,,urn:uuid:9d2d8c3c-c80d-4057-8a5b-1ac1836e28a7,http://test.adu.org.za/symbiota/collections/individual/index.php?occid=133062
133196,BOL,1,,Preserved specimen,133196,146827,146827,Plantae,Chlorophyta,Ulvophyceae,Bryopsidales,Codiaceae,Codium duthieae,26560,P.C.Silva,Codium,duthieae,,,,,,,,,,SANPAD 2000,,,s.n.,,,,,,,,,,,,,,,,,,,0,,,,,,,South Africa,Western Cape,,,,Goukamma Marine Reserve,0,,-34.03333,22.95,,,,,,,,,0,0,,,,,,,,,,,unprocessed,,admin,,8/5/2022 13:03,8/5/2022 13:03,,urn:uuid:addaa0b0-f0b6-42ed-bad4-3f921b7f80a3,http://test.adu.org.za/symbiota/collections/individual/index.php?occid=133196
133198,BOL,1,,Preserved specimen,133198,146829,146829,Plantae,Chlorophyta,Ulvophyceae,Bryopsidales,Codiaceae,Codium duthieae,26560,P.C.Silva,Codium,duthieae,,,"Stegenga, H",,,,,,,SANPAD 2000,,,198,10/13/2000,2000,10,13,,,,,,,,,,,,,,,0,,,,,,,South Africa,Western Cape,,,,Goukamma Marine Reserve.,0,,-34.03333,22.95,,,,,,,,,0,0,,,,,,,,,,,unprocessed,,admin,,8/5/2022 13:03,8/5/2022 13:03,,urn:uuid:ce5f6b71-f261-4fbf-bd6b-2c8fb900450b,http://test.adu.org.za/symbiota/collections/individual/index.php?occid=133198
133612,BOL,1,,Preserved specimen,,147246,147246,Plantae,Chlorophyta,Ulvophyceae,Bryopsidales,Derbesiaceae,Derbesia,33663,,,,,,,,,,,,,SANPAD 2000,,,s.n.,,,,,,,,,,,,,,,,,,,0,,,,,,,South Africa,Western Cape,,,,Goukamma Marine Reserve,0,,-34.03333,22.95,,,,,,,,,0,0,,,,,,,,,,,unprocessed,,admin,,8/5/2022 13:03,11/16/2021 0:00,,urn:uuid:c9d0a714-35e0-45fc-80d4-f95b81c5d361,http://test.adu.org.za/symbiota/collections/individual/index.php?occid=133612
133636,BOL,1,,Preserved specimen,133636,147271,147271,Plantae,Chlorophyta,Ulvophyceae,Ulvales,Ulvaceae,Enteromorpha flexuosa,111475,(Wulfen) J.Agardh,Enteromorpha,flexuosa,,,,,,,,,,SANPAD 2000,,,s.n.,,,,,,,,,,,,,,,,,,,0,,,,,,,South Africa,Western Cape,,,,Goukamma Marine Reserve,0,,-34.03333,22.95,,,,,,,,,0,0,,,,,,,,,,,unprocessed,,admin,,8/5/2022 13:03,8/5/2022 13:03,,urn:uuid:76ed6e13-bed9-4c96-992d-1430f2146372,http://test.adu.org.za/symbiota/collections/individual/index.php?occid=133636
133646,BOL,1,,Preserved specimen,,147281,147281,Plantae,Chlorophyta,Ulvophyceae,Ulvales,Ulvaceae,Enteromorpha compressa,111474,(L.) Nees,Enteromorpha,compressa,,,,,,,,cf.,,SANPAD 2000,,,s.n.,,,,,,,,,,,,,,,,,,,0,,,,,,,South Africa,Western Cape,,,,Goukamma Marine Reserve,0,,-34.03333,22.95,,,,,,,,,0,0,,,,,,,,,,,unprocessed,,admin,,8/5/2022 13:03,11/16/2021 0:00,,urn:uuid:c0a0b407-e7cc-4e11-8a9e-8c4618ebddf3,http://test.adu.org.za/symbiota/collections/individual/index.php?occid=133646
133731,BOL,1,,Preserved specimen,,147367,147367,Plantae,Chlorophyta,Ulvophyceae,Ulvales,Ulvaceae,Enteromorpha,107259,,,,,,,,,,,,,SANPAD expedition,,,s.n.,,,,,,,,,,,,,,,,,,,0,,,,,,,South Africa,Western Cape,,,,Goukamma Marine Reserve,0,,-34.03333,22.95,,,,,,,,,0,0,,,,,,,,,,,unprocessed,,admin,,8/5/2022 13:03,11/16/2021 0:00,,urn:uuid:5ded3388-832c-4e60-92ed-c15c4931c71e,http://test.adu.org.za/symbiota/collections/individual/index.php?occid=133731
133909,BOL,1,,Preserved specimen,,147548,147548,Plantae,Chlorophyta,Ulvophyceae,Cladophorales,Cladophoraceae,Rhizoclonium riparium,38258,(Roth) Harv.,Rhizoclonium,riparium,,,,,,,,,,SANPAD 2000,,,s.n.,,,,,,,,,,,,,,,,,,,0,,,,,,,South Africa,Western Cape,,,,Goukamma Marine Reserve,0,,-34.03333,22.95,,,,,,,,,0,0,,,,,,,,,,,unprocessed,,admin,,8/5/2022 13:03,11/16/2021 0:00,,urn:uuid:0ce001e9-8bef-4ea6-99c8-4b265f0dbe95,http://test.adu.org.za/symbiota/collections/individual/index.php?occid=133909
133915,BOL,1,,Preserved specimen,,147554,147554,Plantae,Chlorophyta,Chlorophyceae,Chaetophorales,Chaetophoraceae,Sporocladopsis novae-zelandiae,38367,V.J.Chapm.,Sporocladopsis,novae-zelandiae,,,,,,,,,,SANPAD 2000,,,s.n.,,,,,,,,,,,,,,,,,,,0,,,,,,,South Africa,Western Cape,,,,Goukamma Marine Reserve,0,,-34.03333,22.95,,,,,,,,,0,0,,,,,,,,,,,unprocessed,,admin,,8/5/2022 13:03,11/16/2021 0:00,,urn:uuid:7c0514de-329b-4cd4-8d59-780138ab395f,http://test.adu.org.za/symbiota/collections/individual/index.php?occid=133915
134099,BOL,1,,Preserved specimen,134099,147739,147739,Plantae,Chlorophyta,Ulvophyceae,Ulvales,Ulvaceae,Ulva rigida,38440,C.Agardh,Ulva,rigida,,,,,,,,,,SANPAD 2000,,,s.n.,,,,,,,,,,,,,,,,,,,0,,,,,,,South Africa,Western Cape,,,,Goukamma Marine Reserve,0,,-34.03333,22.95,,,,,,,,,0,0,,,,,,,,,,,unprocessed,,admin,,8/5/2022 13:03,8/5/2022 13:03,,urn:uuid:8ced4248-c2ec-4128-9e26-5c84de35a508,http://test.adu.org.za/symbiota/collections/individual/index.php?occid=134099
134101,BOL,1,,Preserved specimen,,147741,147741,Plantae,Chlorophyta,Ulvophyceae,Ulvales,Ulvaceae,Ulva spathulata,117368,Papenf.,Ulva,spathulata,,,,,,,,,,SANPAD 2000,,,s.n.,,,,,,,,,,,,,,,,,,,0,,,,,,,South Africa,Western Cape,,,,Goukamma Marine Reserve,0,,-34.03333,22.95,,,,,,,,,0,0,,,,,,,,,,,unprocessed,,admin,,8/5/2022 13:03,11/16/2021 0:00,,urn:uuid:c1865786-df7a-4173-8205-b1dd10bbb80f,http://test.adu.org.za/symbiota/collections/individual/index.php?occid=134101
134234,BOL,1,,Preserved specimen,,147874,147874,Plantae,Chlorophyta,Ulvophyceae,Ulvales,Ulvaceae,Ulva,33856,,,,,,,,,,,,,SANPAD 2000,,,s.n.,,,,,,,,,,,,,,,,,,,0,,,,,,,South Africa,Western Cape,,,,Goukamma Marine Reserve,0,,-34.03333,22.95,,,,,,,,,0,0,,,,,,,,,,,unprocessed,,admin,,8/5/2022 13:03,11/16/2021 0:00,,urn:uuid:ac64ea3e-20ac-476a-b99b-e4d30877c938,http://test.adu.org.za/symbiota/collections/individual/index.php?occid=134234
134235,BOL,1,,Preserved specimen,,147875,147875,Plantae,Chlorophyta,Ulvophyceae,Ulvales,Ulvaceae,Ulva,33856,,,,,,,,,,,,,SANPAD 2000,,,s.n.,,,,,,,,,,,,,,,,,,,0,,,,,,,South Africa,Western Cape,,,,Goukamma Marine Reserve,0,,-34.03333,22.95,,,,,,,,,0,0,,,,,,,,,,,unprocessed,,admin,,8/5/2022 13:03,11/16/2021 0:00,,urn:uuid:5d3f074d-1402-44b2-94a8-712f7f1b3e93,http://test.adu.org.za/symbiota/collections/individual/index.php?occid=134235
134236,BOL,1,,Preserved specimen,,147876,147876,Plantae,Chlorophyta,Ulvophyceae,Ulvales,Ulvaceae,Ulva,33856,,,,,,,,,,,,,SANPAD 2000,,,s.n.,,,,,,,,,,,,,,,,,,,0,,,,,,,South Africa,Western Cape,,,,Goukamma Marine Reserve,0,,-34.03333,22.95,,,,,,,,,0,0,,,,,,,,,,,unprocessed,,admin,,8/5/2022 13:03,11/16/2021 0:00,,urn:uuid:d748e87d-c7fc-48e3-8987-7fbc21af5ee0,http://test.adu.org.za/symbiota/collections/individual/index.php?occid=134236
132504,BOL,1,,Preserved specimen,,146115,146115,Plantae,Chlorophyta,Ulvophyceae,Bryopsidales,Caulerpaceae,Caulerpa filiformis,26429,(Suhr) K.Hering,Caulerpa,filiformis,,,,,,,,,,"Stegenga, H.",,,s.n.,,,,,,,,,,,,,,,,,,,0,,,,,,,South Africa,Eastern Cape,Hogsback,,,Kini Bay,0,,-34.02722,25.37722,,,,,,,,,0,0,,,,,,,,,,,unprocessed,,admin,,8/5/2022 13:03,11/9/2021 0:00,,urn:uuid:084f31f5-4ad6-4a59-a63a-10bba9bbd1fa,http://test.adu.org.za/symbiota/collections/individual/index.php?occid=132504
133273,BOL,1,,Preserved specimen,133273,146904,146904,Plantae,Chlorophyta,Ulvophyceae,Bryopsidales,Codiaceae,Codium extricatum,26561,P.C.Silva,Codium,extricatum,,,,,,,,,,"Stegenga, H.",,,s.n.,,,,,,,,,,,,,,,,,,,0,,,,,,,South Africa,Eastern Cape,Hogsback,,,Kini Bay,0,,-34.02722,25.37722,,,,,,,,,0,0,,,,,,,,,,,unprocessed,,admin,,8/5/2022 13:03,8/5/2022 13:03,,urn:uuid:39073861-3101-4618-b402-476bca60d131,http://test.adu.org.za/symbiota/collections/individual/index.php?occid=133273
133345,BOL,1,,Preserved specimen,,146977,146977,Plantae,Chlorophyta,Ulvophyceae,Bryopsidales,Codiaceae,Codium lucasii subsp. capense,29458,P.C.Silva,Codium,lucasii,subsp.,capense,,,,,,,,"Stegenga, H.",,,s.n.,,,,,,,,,,,,,,,,,,,0,,,,,,,South Africa,Eastern Cape,Hogsback,,,Kini Bay,0,,-34.02722,25.37722,,,,,,,,,0,0,,,,,,,,,,,unprocessed,,admin,,8/5/2022 13:03,11/9/2021 0:00,,urn:uuid:22109019-1a03-4cbd-b786-6d8bcdefefc4,http://test.adu.org.za/symbiota/collections/individual/index.php?occid=133345
133376,BOL,1,,Preserved specimen,,147009,147009,Plantae,Chlorophyta,Ulvophyceae,Bryopsidales,Codiaceae,Codium lucasii subsp. capense,29458,P.C.Silva,Codium,lucasii,subsp.,capense,,,,,,,,"Stegenga, H.",,,s.n.,,,,,,,,,,,,,,,,,,,0,,,,,,,South Africa,Eastern Cape,Hogsback,,,Kini Bay,0,,-34.02722,25.37722,,,,,,,,,0,0,,,,,,,,,,,unprocessed,,admin,,8/5/2022 13:03,11/9/2021 0:00,,urn:uuid:7dd037b5-9165-48aa-aee5-a1a2d0206d83,http://test.adu.org.za/symbiota/collections/individual/index.php?occid=133376
133459,BOL,1,,Preserved specimen,133459,147093,147093,Plantae,Chlorophyta,Ulvophyceae,Bryopsidales,Codiaceae,Codium stephensiae,26572,C.I.Dickinson,Codium,stephensiae,,,,,,,,,,"Stegenga, H.",,,s.n.,,,,,,,,,,,,,,,,,,,0,,,,,,,South Africa,Eastern Cape,Hogsback,,,Kini Bay,0,,-34.02722,25.37722,,,,,,,,,0,0,,,,,,,,,,,unprocessed,,admin,,8/5/2022 13:03,8/5/2022 13:03,,urn:uuid:0c56a9f9-1583-4360-834c-882360b3c895,http://test.adu.org.za/symbiota/collections/individual/index.php?occid=133459
133657,BOL,1,,Preserved specimen,133657,147292,147292,Plantae,Chlorophyta,Ulvophyceae,Ulvales,Ulvaceae,Enteromorpha intestinalis,111476,(L.) Nees,Enteromorpha,intestinalis,,,,,,,,,,"Stegenga, H.",,,s.n.,,,,,,,,,,,,,,,,,,,0,,,,,,,South Africa,Eastern Cape,Hogsback,,,Kini Bay,0,,-34.02722,25.37722,,,,,,,,,0,0,,,,,,,,,,,unprocessed,,admin,,8/5/2022 13:03,8/5/2022 13:03,,urn:uuid:846705fd-d842-4c16-8a94-f36c7bf6a0c1,http://test.adu.org.za/symbiota/collections/individual/index.php?occid=133657
133850,BOL,1,,Preserved specimen,,147487,147487,Plantae,Chlorophyta,Ulvophyceae,Bryopsidales,Halimedaceae,Halimeda cuneata,38032,K.Hering,Halimeda,cuneata,,,,,,,,,,"Stegenga, H.",,,s.n.,,,,,,,,,,,,,,,,,,,0,,,,,,,South Africa,Eastern Cape,Hogsback,,,Kini Bay,0,,-34.02722,25.37722,,,,,,,,,0,0,,,,,,,,,,,unprocessed,,admin,,8/5/2022 13:03,11/9/2021 0:00,,urn:uuid:4c015ffb-30fd-4ac4-a348-d5638732f13e,http://test.adu.org.za/symbiota/collections/individual/index.php?occid=133850
133905,BOL,1,,Preserved specimen,,147544,147544,Plantae,Chlorophyta,Ulvophyceae,Cladophorales,Cladophoraceae,Rhizoclonium riparium,38258,(Roth) Harv.,Rhizoclonium,riparium,,,,,,,,,,"Stegenga, H.",,,s.n.,,,,,,,,,,,,,,,,,,,0,,,,,,,South Africa,Eastern Cape,Hogsback,,,Kini Bay,0,,-34.02722,25.37722,,,,,,,,,0,0,,,,,,,,,,,unprocessed,,admin,,8/5/2022 13:03,11/9/2021 0:00,,urn:uuid:73573896-56d6-4800-8149-acf2cb0dd56d,http://test.adu.org.za/symbiota/collections/individual/index.php?occid=133905
132534,BOL,1,,Preserved specimen,,146146,146146,Plantae,Chlorophyta,Ulvophyceae,Bryopsidales,Caulerpaceae,Caulerpa filiformis,26429,(Suhr) K.Hering,Caulerpa,filiformis,,,,,,,,,,"Stegenga, H.",,,s.n.,,,,,,,,,,,,,,,,,,,0,,,,,,,South Africa,Western Cape,,,,Tsitsikamma Park Toorbaai,0,,-34.025,23.88333,,,,,,,,,0,0,,,,,,,,,,,unprocessed,,admin,,8/5/2022 13:03,11/16/2021 0:00,,urn:uuid:a8346710-3e8b-4e27-a288-75d9d7450470,http://test.adu.org.za/symbiota/collections/individual/index.php?occid=132534
132339,BOL,1,,Preserved specimen,,145947,145947,Plantae,Chlorophyta,Ulvophyceae,Bryopsidales,Bryopsidaceae,Bryopsis africana,37827,Aresch.,Bryopsis,africana,,,,,,,,,,"Bolton, J.J.",,"Stegenga, H",s.n.,,,,,,,,,,,,,,,,,,,0,,,,,,,South Africa,Western Cape,,,,Tsitsikamma Park opposite office,0,,-34.025,23.91667,,,,,,,,,0,0,,,,,,,,,,,unprocessed,,admin,,8/5/2022 13:03,11/16/2021 0:00,,urn:uuid:bffd1c50-987d-420a-99ee-578e61716e66,http://test.adu.org.za/symbiota/collections/individual/index.php?occid=132339
133064,BOL,1,,Preserved specimen,,146693,146693,Plantae,Chlorophyta,Ulvophyceae,Cladophorales,Cladophoraceae,Cladophora radiosa,73577,(Suhr) Kutz.,Cladophora,radiosa,,,,,,,,,,"Bolton, J.J.",,"Stegenga, H",s.n.,,,,,,,,,,,,,,,,,,,0,,,,,,,South Africa,Western Cape,,,,Tsitsikamma Park opposite office,0,,-34.025,23.91667,,,,,,,,,0,0,,,,,,,,,,,unprocessed,,admin,,8/5/2022 13:03,11/16/2021 0:00,,urn:uuid:a3296c83-679b-4130-a081-8cbafb48c49f,http://test.adu.org.za/symbiota/collections/individual/index.php?occid=133064
133284,BOL,1,,Preserved specimen,133284,146915,146915,Plantae,Chlorophyta,Ulvophyceae,Bryopsidales,Codiaceae,Codium extricatum,26561,P.C.Silva,Codium,extricatum,,,,,,,,,,"Anderson, R.J.",,,s.n.,,,,,,,,,,,,,,,,,,,0,,,,,,,South Africa,Western Cape,,,,Tsitsikamma Park  near Scot's Hut,0,,-34.025,23.91667,,,,,,,,,0,0,,,,,,,,,,,unprocessed,,admin,,8/5/2022 13:03,8/5/2022 13:03,,urn:uuid:b6750d54-e6d0-43e9-ba38-9a8016a0a24f,http://test.adu.org.za/symbiota/collections/individual/index.php?occid=133284
133328,BOL,1,,Preserved specimen,133328,146960,146960,Plantae,Chlorophyta,Ulvophyceae,Bryopsidales,Codiaceae,Codium incognitum,26562,P.C.Silva,Codium,incognitum,,,,,,,,,,"Anderson, R.J.",,,s.n.,,,,,,,,,,,,,,,,,,,0,,,,,,,South Africa,Western Cape,,,,Tsitsikamma Park  near Scot's Hut,0,,-34.025,23.91667,,,,,,,,,0,0,,,,,,,,,,,unprocessed,,admin,,8/5/2022 13:03,8/5/2022 13:03,,urn:uuid:41f9dd16-1eaf-4743-a247-37f904a459bb,http://test.adu.org.za/symbiota/collections/individual/index.php?occid=133328
133542,BOL,1,,Preserved specimen,133542,147176,147176,Plantae,Chlorophyta,Ulvophyceae,Bryopsidales,Codiaceae,Codium stephensiae,26572,C.I.Dickinson,Codium,stephensiae,,,,,,,,,,"Anderson, R.J.",,"Bolton, J.J.",s.n.,,,,,,,,,,,,,,,,,,,0,,,,,,,South Africa,Western Cape,,,,Tsitsikamma Coast,0,,-34.025,23.91667,,,,,,,,,0,0,,,,,,,,,,,unprocessed,,admin,,8/5/2022 13:03,8/5/2022 13:03,,urn:uuid:2ee8ee97-c069-446e-b90c-7ecd7fef5e63,http://test.adu.org.za/symbiota/collections/individual/index.php?occid=133542
133543,BOL,1,,Preserved specimen,133543,147177,147177,Plantae,Chlorophyta,Ulvophyceae,Bryopsidales,Codiaceae,Codium stephensiae,26572,C.I.Dickinson,Codium,stephensiae,,,,,,,,,,"Anderson, R.J.",,,s.n.,,,,,,,,,,,,,,,,,,,0,,,,,,,South Africa,Western Cape,,,,Tsitsikamma Park  opposite office,0,,-34.025,23.91667,,,,,,,,,0,0,,,,,,,,,,,unprocessed,,admin,,8/5/2022 13:03,8/5/2022 13:03,,urn:uuid:07b160bc-28ea-485b-b783-fff4a16a8167,http://test.adu.org.za/symbiota/collections/individual/index.php?occid=133543
134259,BOL,1,,Preserved specimen,,147899,147899,Plantae,Chlorophyta,Ulvophyceae,Ulvales,Ulvaceae,Ulva,33856,,,,,,,,,,,,,"Bolton, J.J.",,"Stegenga, H",s.n.,,,,,,,,,,,,,,,,,,,0,,,,,,,South Africa,Western Cape,,,,Tsitsikamma Park opposite office,0,,-34.025,23.91667,,,,,,,,,0,0,,,,,,,,,,,unprocessed,,admin,,8/5/2022 13:03,11/16/2021 0:00,,urn:uuid:9ca36d3c-eb00-41f1-84c2-106574552d99,http://test.adu.org.za/symbiota/collections/individual/index.php?occid=134259
133149,BOL,1,,Preserved specimen,,146778,146778,Plantae,Chlorophyta,Ulvophyceae,Cladophorales,Cladophoraceae,Cladophora,33651,,,,,,,,,,,,,"Isaac, W.E.",,,s.n.,,,,,,,,,,,,,,,,,,,0,,,,,,,South Africa,Western Cape,,,,Storms River Mouth,0,,-34.02,23.90333,,,,,,,,,0,0,,,,,,,,,,,unprocessed,,admin,,8/5/2022 13:03,11/16/2021 0:00,,urn:uuid:ea635655-2695-4dc1-babe-33cd17f29fff,http://test.adu.org.za/symbiota/collections/individual/index.php?occid=133149
133329,BOL,1,,Preserved specimen,133329,146961,146961,Plantae,Chlorophyta,Ulvophyceae,Bryopsidales,Codiaceae,Codium incognitum,26562,P.C.Silva,Codium,incognitum,,,,,,,,,,"Anderson, R.J.",,"Allen, J.A.",s.n.,,,,,,,,,,,,,,,,,,,0,,,,,,,South Africa,Western Cape,,,,Tsitsikamma Park  Middlebank,0,,-34.02,23.90333,,,,,,,,,0,0,,,,,,,,,,,unprocessed,,admin,,8/5/2022 13:03,8/5/2022 13:03,,urn:uuid:f8428657-ea61-4ee5-8a71-843b830d6743,http://test.adu.org.za/symbiota/collections/individual/index.php?occid=133329
134029,BOL,1,,Preserved specimen,134029,147668,147668,Plantae,Chlorophyta,Ulvophyceae,Ulvales,Ulvaceae,Ulva fasciata,38433,Delile,Ulva,fasciata,,,,,,,,,,"Seagrief, S.C.",,,s.n.,,,,,,,,,,,,,,,,,,,0,,,,,,,South Africa,Western Cape,,,,West of Storms River Mouth,0,,-34.02,23.90333,,,,,,,,,0,0,,,,,,,,,,,unprocessed,,admin,,8/5/2022 13:03,8/5/2022 13:03,,urn:uuid:b1177164-882a-4fd6-a700-efe3ca2511bf,http://test.adu.org.za/symbiota/collections/individual/index.php?occid=134029
134125,BOL,1,,Preserved specimen,,147765,147765,Plantae,Chlorophyta,Ulvophyceae,Ulvales,Ulvaceae,Ulva fasciata,38433,Delile,Ulva,fasciata,,,,,,,,cf.,,"Anderson, R.J.",,"Bolton, J.J.",s.n.,,,,,,,,,,,,,,,,,,,0,,,,,,,South Africa,Western Cape,,,,Tsitsikamma Park Storms River Mouth,0,,-34.02,23.90333,,,,,,,,,0,0,,,,,,,,,,,unprocessed,,admin,,8/5/2022 13:03,11/16/2021 0:00,,urn:uuid:3493d484-1869-4d72-a0c4-2c0cb99794f7,http://test.adu.org.za/symbiota/collections/individual/index.php?occid=134125
134225,BOL,1,,Preserved specimen,,147865,147865,Plantae,Chlorophyta,Ulvophyceae,Ulvales,Ulvaceae,Ulva uncialis,38443,(Kutz.) Mont.,Ulva,uncialis,,,,,,,,cf.,,"Seagrief, S.C.",,,s.n.,,,,,,,,,,,,,,,,,,,0,,,,,,,South Africa,Western Cape,,,,Storms River Mouth,0,,-34.02,23.90333,,,,,,,,,0,0,,,,,,,,,,,unprocessed,,admin,,8/5/2022 13:03,11/16/2021 0:00,,urn:uuid:c2db3305-7e35-4b5a-95fe-b094a939f8de,http://test.adu.org.za/symbiota/collections/individual/index.php?occid=134225
134226,BOL,1,,Preserved specimen,,147866,147866,Plantae,Chlorophyta,Ulvophyceae,Ulvales,Ulvaceae,Ulva,33856,,,,,,,,,,,,,"Seagrief, S.C.",,,s.n.,,,,,,,,,,,,,,,,,,,0,,,,,,,South Africa,Western Cape,,,,Storms River Mouth,0,,-34.02,23.90333,,,,,,,,,0,0,,,,,,,,,,,unprocessed,,admin,,8/5/2022 13:03,11/16/2021 0:00,,urn:uuid:36bfb244-2c67-4989-b254-5beac382d281,http://test.adu.org.za/symbiota/collections/individual/index.php?occid=134226
133414,BOL,1,,Preserved specimen,,147047,147047,Plantae,Chlorophyta,Ulvophyceae,Bryopsidales,Codiaceae,Codium platylobium,26568,Aresch.,Codium,platylobium,,,,,,,,,,West,,,s.n.,,,,,,,,,,,,,,,,,,,0,,,,,,,South Africa,Eastern Cape,Hogsback,,,Algoa Bay,0,,-34.01722,25.695,,,,,,,,,0,0,,,,,,,,,,,unprocessed,,admin,,8/5/2022 13:03,11/9/2021 0:00,,urn:uuid:82b71828-19d4-498c-a44f-17b463bf2b21,http://test.adu.org.za/symbiota/collections/individual/index.php?occid=133414
133449,BOL,1,,Preserved specimen,,147083,147083,Plantae,Chlorophyta,Ulvophyceae,Bryopsidales,Codiaceae,Codium platylobium,26568,Aresch.,Codium,platylobium,,,,,,,,,,West,,,s.n.,,,,,,,,,,,,,,,,,,,0,,,,,,,South Africa,Eastern Cape,Hogsback,,,Algoa Bay,0,,-34.01722,25.695,,,,,,,,,0,0,,,,,,,,,,,unprocessed,,admin,,8/5/2022 13:03,11/9/2021 0:00,,urn:uuid:0d03c591-8905-400d-b4fb-d76ffd4bf27f,http://test.adu.org.za/symbiota/collections/individual/index.php?occid=133449
133450,BOL,1,,Preserved specimen,,147084,147084,Plantae,Chlorophyta,Ulvophyceae,Bryopsidales,Codiaceae,Codium platylobium,26568,Aresch.,Codium,platylobium,,,,,,,,,,"Tyson, W.",,,s.n.,,,,,,,,,,,,,,,,,,,0,,,,,,,South Africa,Eastern Cape,Hogsback,,,Algoa Bay,0,,-34.01722,25.695,,,,,,,,,0,0,,,,,,,,,,,unprocessed,,admin,,8/5/2022 13:03,11/9/2021 0:00,,urn:uuid:edc8ab35-70a3-4569-9aaa-a409d5f23e99,http://test.adu.org.za/symbiota/collections/individual/index.php?occid=133450
133794,BOL,1,,Preserved specimen,,147431,147431,Plantae,Chlorophyta,Ulvophyceae,Bryopsidales,Halimedaceae,Halimeda cuneata,38032,K.Hering,Halimeda,cuneata,,,,,,,,,,"Tyson, W.",,,s.n.,,,,,,,,,,,,,,,,,,,0,,,,,,,South Africa,Eastern Cape,Hogsback,,,Algoa Bay,0,,-34.01722,25.695,,,,,,,,,0,0,,,,,,,,,,,unprocessed,,admin,,8/5/2022 13:03,11/9/2021 0:00,,urn:uuid:85eb2468-ee1b-46bc-b57d-f0f490ee5acc,http://test.adu.org.za/symbiota/collections/individual/index.php?occid=133794
133797,BOL,1,,Preserved specimen,,147434,147434,Plantae,Chlorophyta,Ulvophyceae,Bryopsidales,Halimedaceae,Halimeda cuneata,38032,K.Hering,Halimeda,cuneata,,,,,,,,,,Unknown,,,s.n.,,,,,,,,,,,,,,,,,,,0,,,,,,,South Africa,Eastern Cape,Hogsback,,,Algoa Bay,0,,-34.01722,25.695,,,,,,,,,0,0,,,,,,,,,,,unprocessed,,admin,,8/5/2022 13:03,11/9/2021 0:00,,urn:uuid:a3d15ac2-6ac4-432e-b361-d657e1539d89,http://test.adu.org.za/symbiota/collections/individual/index.php?occid=133797
133826,BOL,1,,Preserved specimen,,147463,147463,Plantae,Chlorophyta,Ulvophyceae,Bryopsidales,Halimedaceae,Halimeda cuneata,38032,K.Hering,Halimeda,cuneata,,,,,,,,,,"Tyson, W.",,,s.n.,,,,,,,,,,,,,,,,,,,0,,,,,,,South Africa,Eastern Cape,Hogsback,,,Algoa Bay,0,,-34.01722,25.695,,,,,,,,,0,0,,,,,,,,,,,unprocessed,,admin,,8/5/2022 13:03,11/9/2021 0:00,,urn:uuid:0c4757c8-b7bb-4851-b1ad-d4056f2c6dfa,http://test.adu.org.za/symbiota/collections/individual/index.php?occid=133826
134940,BOL,1,,Preserved specimen,134940,148588,148588,Plantae,Rhodophyta,Florideophyceae,Ceramiales,Ceramiaceae,Spyridia cupressina,,Kützing,,,,,,,,,,,,Unknown,,,s.n.,,,,,,,,,,,,,,,,,,,0,,,,,,,South Africa,Eastern Cape,Hogsback,,,Algoa Bay,0,,-34.01722,25.695,,,,,,,,,0,0,,,,,,,,,,,unprocessed,,admin,,8/5/2022 13:03,8/5/2022 13:03,,urn:uuid:019e0fd9-9457-4836-be57-13662d051300,http://test.adu.org.za/symbiota/collections/individual/index.php?occid=134940
134028,BOL,1,,Preserved specimen,134028,147667,147667,Plantae,Chlorophyta,Ulvophyceae,Ulvales,Ulvaceae,Ulva fasciata,38433,Delile,Ulva,fasciata,,,,,,,,,,"Seagrief, S.C.",,,s.n.,,,,,,,,,,,,,,,,,,,0,,,,,,,South Africa,Western Cape,,,,Iml. West of Storms River Mouth,0,,-34.01667,23.9,,,,,,,,,0,0,,,,,,,,,,,unprocessed,,admin,,8/5/2022 13:03,8/5/2022 13:03,,urn:uuid:0cf73dd3-d76f-46e8-bbb5-6f5b0b309d60,http://test.adu.org.za/symbiota/collections/individual/index.php?occid=134028
132358,BOL,1,,Preserved specimen,,145968,145968,Plantae,Chlorophyta,Ulvophyceae,Bryopsidales,Bryopsidaceae,Bryopsis flanaganii,116038,E.S.Barton,Bryopsis,flanaganii,,,,,,,,cf.,,"Stegenga, H.",,,s.n.,,,,,,,,,,,,,,,,,,,0,,,,,,,South Africa,Western Cape,,,,Keurboomstrand,0,,-34,23.45,,,,,,,,,0,0,,,,,,,,,,,unprocessed,,admin,,8/5/2022 13:03,11/16/2021 0:00,,urn:uuid:bd0c1c2d-5199-412f-a7d6-f9091e9d9bb8,http://test.adu.org.za/symbiota/collections/individual/index.php?occid=132358
132503,BOL,1,,Preserved specimen,,146114,146114,Plantae,Chlorophyta,Ulvophyceae,Bryopsidales,Caulerpaceae,Caulerpa filiformis,26429,(Suhr) K.Hering,Caulerpa,filiformis,,,,,,,,,,"Stegenga, H.",,,s.n.,,,,,,,,,,,,,,,,,,,0,,,,,,,South Africa,Western Cape,,,,Keurboomstrand - east,0,,-34,23.45,,,,,,,,,0,0,,,,,,,,,,,unprocessed,,admin,,8/5/2022 13:03,11/16/2021 0:00,,urn:uuid:6cae9662-d208-41d5-ae88-14366f1dc0ce,http://test.adu.org.za/symbiota/collections/individual/index.php?occid=132503
133272,BOL,1,,Preserved specimen,133272,146903,146903,Plantae,Chlorophyta,Ulvophyceae,Bryopsidales,Codiaceae,Codium extricatum,26561,P.C.Silva,Codium,extricatum,,,,,,,,,,"Stegenga, H.",,,s.n.,,,,,,,,,,,,,,,,,,,0,,,,,,,South Africa,Western Cape,,,,Keurboomstrand - east,0,,-34,23.45,,,,,,,,,0,0,,,,,,,,,,,unprocessed,,admin,,8/5/2022 13:03,8/5/2022 13:03,,urn:uuid:2044b4a8-8666-43db-a6b7-7e1b670c59de,http://test.adu.org.za/symbiota/collections/individual/index.php?occid=133272
133344,BOL,1,,Preserved specimen,,146976,146976,Plantae,Chlorophyta,Ulvophyceae,Bryopsidales,Codiaceae,Codium lucasii subsp. capense,29458,P.C.Silva,Codium,lucasii,subsp.,capense,,,,,,,,"Stegenga, H.",,,s.n.,,,,,,,,,,,,,,,,,,,0,,,,,,,South Africa,Western Cape,,,,Keurboomstrand,0,,-34,23.45,,,,,,,,,0,0,,,,,,,,,,,unprocessed,,admin,,8/5/2022 13:03,11/16/2021 0:00,,urn:uuid:51718b33-29d7-4335-9004-eea9d33a4678,http://test.adu.org.za/symbiota/collections/individual/index.php?occid=133344
132341,BOL,1,,Preserved specimen,,145949,145949,Plantae,Chlorophyta,Ulvophyceae,Bryopsidales,Bryopsidaceae,Bryopsis africana,37827,Aresch.,Bryopsis,africana,,,,,,,,,,"Bolton, J.J.",,"Stegenga, H",s.n.,,,,,,,,,,,,,,,,,,,0,,,,,,,South Africa,Western Cape,,,,Tsitsikamma Park near Beyers se Eiland,0,,-34,23.78333,,,,,,,,,0,0,,,,,,,,,,,unprocessed,,admin,,8/5/2022 13:03,11/16/2021 0:00,,urn:uuid:fef3f93b-fd34-4581-ae94-03d08afe67a3,http://test.adu.org.za/symbiota/collections/individual/index.php?occid=132341
132577,BOL,1,,Preserved specimen,,146189,146189,Plantae,Chlorophyta,Ulvophyceae,Bryopsidales,Caulerpaceae,Caulerpa filiformis,26429,(Suhr) K.Hering,Caulerpa,filiformis,,,,,,,,,,"Bolton, J.J.",,"Stegenga, H",s.n.,,,,,,,,,,,,,,,,,,,0,,,,,,,South Africa,Western Cape,,,,Tsitsikamma Park near Beyers se Eiland,0,,-34,23.78333,,,,,,,,,0,0,,,,,,,,,,,unprocessed,,admin,,8/5/2022 13:03,11/16/2021 0:00,,urn:uuid:2d4fafc4-9397-4ff2-996e-bb0b813e84bd,http://test.adu.org.za/symbiota/collections/individual/index.php?occid=132577
132731,BOL,1,,Preserved specimen,,146345,146345,Plantae,Chlorophyta,Ulvophyceae,Cladophorales,Cladophoraceae,Chaetomorpha aerea,37878,(Dillwyn) Kutz.,Chaetomorpha,aerea,,,,,,,,,,"Bolton, J.J.",,,s.n.,,,,,,,,,,,,,,,,,,,0,,,,,,,South Africa,Western Cape,,,,Tsitsikamma Park near Geelhoutbosriviermond,0,,-34,23.78333,,,,,,,,,0,0,,,,,,,,,,,unprocessed,,admin,,8/5/2022 13:03,11/16/2021 0:00,,urn:uuid:ab8ec175-af6f-4736-ac68-7f527e589e8f,http://test.adu.org.za/symbiota/collections/individual/index.php?occid=132731
133065,BOL,1,,Preserved specimen,,146694,146694,Plantae,Chlorophyta,Ulvophyceae,Cladophorales,Cladophoraceae,Cladophora radiosa,73577,(Suhr) Kutz.,Cladophora,radiosa,,,,,,,,,,"Bolton, J.J.",,"Stegenga, H",s.n.,,,,,,,,,,,,,,,,,,,0,,,,,,,South Africa,Western Cape,,,,Tsitsikamma Park near Beyers se Eiland,0,,-34,23.78333,,,,,,,,,0,0,,,,,,,,,,,unprocessed,,admin,,8/5/2022 13:03,11/16/2021 0:00,,urn:uuid:9f3768ad-3b80-48d4-9ea2-d9835ad9cc3c,http://test.adu.org.za/symbiota/collections/individual/index.php?occid=133065
133119,BOL,1,,Preserved specimen,,146748,146748,Plantae,Chlorophyta,Ulvophyceae,Cladophorales,Cladophoraceae,Cladophora,33651,,,,,,,,,,,,,"Bolton, J.J.",,,s.n.,,,,,,,,,,,,,,,,,,,0,,,,,,,South Africa,Western Cape,,,,Tsitsikamma Park near Geelhoutbosriviermond,0,,-34,23.78333,,,,,,,,,0,0,,,,,,,,,,,unprocessed,,admin,,8/5/2022 13:03,11/16/2021 0:00,,urn:uuid:22153076-c9d1-4cf2-8591-a775edbe6bf2,http://test.adu.org.za/symbiota/collections/individual/index.php?occid=133119
133282,BOL,1,,Preserved specimen,133282,146913,146913,Plantae,Chlorophyta,Ulvophyceae,Bryopsidales,Codiaceae,Codium extricatum,26561,P.C.Silva,Codium,extricatum,,,,,,,,,,"Bolton, J.J.",,"Stegenga, H",s.n.,,,,,,,,,,,,,,,,,,,0,,,,,,,South Africa,Western Cape,,,,Tsitsikamma Park  near Beyers se Eiland,0,,-34,23.78333,,,,,,,,,0,0,,,,,,,,,,,unprocessed,,admin,,8/5/2022 13:03,8/5/2022 13:03,,urn:uuid:a7621b68-8fda-419b-96e3-00fce63e7a69,http://test.adu.org.za/symbiota/collections/individual/index.php?occid=133282
133295,BOL,1,,Preserved specimen,,146927,146927,Plantae,Chlorophyta,Ulvophyceae,Bryopsidales,Codiaceae,Codium fragile,21722,(Suringar) Har.,Codium,fragile,,,,,,,,,,"Bolton, J.J.",,,s.n.,,,,,,,,,,,,,,,,,,,0,,,,,,,South Africa,Western Cape,,,,Tsitsikamma Park near Geelhoutbosriviermond,0,,-34,23.78333,,,,,,,,,0,0,,,,,,,,,,,unprocessed,,admin,,8/5/2022 13:03,11/16/2021 0:00,,urn:uuid:b14564cb-70f9-4731-9317-3c61031acd12,http://test.adu.org.za/symbiota/collections/individual/index.php?occid=133295
133354,BOL,1,,Preserved specimen,,146986,146986,Plantae,Chlorophyta,Ulvophyceae,Bryopsidales,Codiaceae,Codium lucasii subsp. capense,29458,P.C.Silva,Codium,lucasii,subsp.,capense,,,,,,,,"Bolton, J.J.",,"Stegenga, H",s.n.,,,,,,,,,,,,,,,,,,,0,,,,,,,South Africa,Western Cape,,,,Tsitsikamma Park near Beyers se Eiland,0,,-34,23.78333,,,,,,,,,0,0,,,,,,,,,,,unprocessed,,admin,,8/5/2022 13:03,11/16/2021 0:00,,urn:uuid:cf50fe25-89ca-410b-89a4-f45e1f6c9fd1,http://test.adu.org.za/symbiota/collections/individual/index.php?occid=133354
133529,BOL,1,,Preserved specimen,133529,147163,147163,Plantae,Chlorophyta,Ulvophyceae,Bryopsidales,Codiaceae,Codium stephensiae,26572,C.I.Dickinson,Codium,stephensiae,,,,,,,,,,"Bolton, J.J.",,"Stegenga, H",s.n.,,,,,,,,,,,,,,,,,,,0,,,,,,,South Africa,Western Cape,,,,Tsitsikamma Park  near Beyers se Eiland,0,,-34,23.78333,,,,,,,,,0,0,,,,,,,,,,,unprocessed,,admin,,8/5/2022 13:03,8/5/2022 13:03,,urn:uuid:8fe5acea-eb6c-4049-9e4f-c44921bdbdb2,http://test.adu.org.za/symbiota/collections/individual/index.php?occid=133529
133547,BOL,1,,Preserved specimen,,147181,147181,Plantae,Chlorophyta,Ulvophyceae,Bryopsidales,Codiaceae,Codium pocockiae,26569,P.C.Silva,Codium,pocockiae,,,,,,,,cf.,,"Bolton, J.J.",,"Stegenga, H",s.n.,,,,,,,,,,,,,,,,,,,0,,,,,,,South Africa,Western Cape,,,,Tsitsikamma Park near Beyers se Eiland,0,,-34,23.78333,,,,,,,,,0,0,,,,,,,,,,,unprocessed,,admin,,8/5/2022 13:03,11/16/2021 0:00,,urn:uuid:32ea39b0-79e8-461c-bae5-78fa837964ff,http://test.adu.org.za/symbiota/collections/individual/index.php?occid=133547
133548,BOL,1,,Preserved specimen,133548,147182,147182,Plantae,Chlorophyta,Ulvophyceae,Bryopsidales,Codiaceae,Codium duthieae,26560,P.C.Silva,Codium,duthieae,,,"Stegenga, H",,,,,,,"Bolton, J.J.",,"Stegenga, H",255,10/16/1997,1997,10,16,,,,,Intertidal pools.,,,,,,,,,,0,,,,,,,South Africa,Western Cape,,,,Tsitsikamma Park near Beyers se Eiland.,0,,-34,23.78333,,,,,,,,,0,0,,,,,,,,,,,unprocessed,,admin,,8/5/2022 13:03,8/5/2022 13:03,,urn:uuid:1aa27aa5-37a5-4f28-a072-09ba6d51828e,http://test.adu.org.za/symbiota/collections/individual/index.php?occid=133548
133738,BOL,1,,Preserved specimen,,147374,147374,Plantae,Chlorophyta,Ulvophyceae,Ulvales,Ulvaceae,Enteromorpha flexuosa,111475,(Wulfen) J.Agardh,Enteromorpha,flexuosa,,,,,,,,cf.,,"Bolton, J.J.",,"Stegenga, H",s.n.,,,,,,,,,,,,,,,,,,,0,,,,,,,South Africa,Western Cape,,,,Tsitsikamma Park near Beyers se Eiland,0,,-34,23.78333,,,,,,,,,0,0,,,,,,,,,,,unprocessed,,admin,,8/5/2022 13:03,11/16/2021 0:00,,urn:uuid:552cf923-1970-4d13-bb11-5226da19ad7f,http://test.adu.org.za/symbiota/collections/individual/index.php?occid=133738
134070,BOL,1,,Preserved specimen,,147710,147710,Plantae,Chlorophyta,Ulvophyceae,Ulvales,Ulvaceae,Ulva rhacodes,38439,(Holmes) Papenf.,Ulva,rhacodes,,,,,,,,,,"Bolton, J.J.",,,s.n.,,,,,,,,,,,,,,,,,,,0,,,,,,,South Africa,Western Cape,,,,Tsitsikamma Park near Geelhoutbosriviermond,0,,-34,23.78333,,,,,,,,,0,0,,,,,,,,,,,unprocessed,,admin,,8/5/2022 13:03,11/16/2021 0:00,,urn:uuid:89fcbbe4-c821-4bab-b651-88c8d70f1e6d,http://test.adu.org.za/symbiota/collections/individual/index.php?occid=134070
134243,BOL,1,,Preserved specimen,,147883,147883,Plantae,Chlorophyta,Ulvophyceae,Ulvales,Ulvaceae,Ulva,33856,,,,,,,,,,,,,"Bolton, J.J.",,"Stegenga, H",s.n.,,,,,,,,,,,,,,,,,,,0,,,,,,,South Africa,Western Cape,,,,Tsitsikamma Park near Beyers se Eiland,0,,-34,23.78333,,,,,,,,,0,0,,,,,,,,,,,unprocessed,,admin,,8/5/2022 13:03,11/16/2021 0:00,,urn:uuid:6a53c266-7192-4afd-a672-57c5fbf6b922,http://test.adu.org.za/symbiota/collections/individual/index.php?occid=134243
133745,BOL,1,,Preserved specimen,,147381,147381,Plantae,Chlorophyta,Ulvophyceae,Ulvales,Ulvaceae,Enteromorpha,107259,,,,,,,,,,,,,"Seagrief, S.C.",,,s.n.,,,,,,,,,,,,,,,,,,,0,,,,,,,South Africa,Eastern Cape,Hogsback,,,Flat Rocks,0,,-33.99722,25.68667,,,,,,,,,0,0,,,,,,,,,,,unprocessed,,admin,,8/5/2022 13:03,11/11/2021 0:00,,urn:uuid:967531f3-5155-4cee-8a20-5853137f53e3,http://test.adu.org.za/symbiota/collections/individual/index.php?occid=133745
133352,BOL,1,,Preserved specimen,,146984,146984,Plantae,Chlorophyta,Ulvophyceae,Bryopsidales,Codiaceae,Codium lucasii subsp. capense,29458,P.C.Silva,Codium,lucasii,subsp.,capense,,,,,,,,"Anderson, R.J.",,"Bolton, J.J.",s.n.,,,,,,,,,,,,,,,,,,,0,,,,,,,South Africa,Western Cape,,,,Nature's Valley,0,,-33.98889,23.54639,,,,,,,,,0,0,,,,,,,,,,,unprocessed,,admin,,8/5/2022 13:03,11/16/2021 0:00,,urn:uuid:445a156d-e794-438b-80f7-3cf022b7e0b7,http://test.adu.org.za/symbiota/collections/individual/index.php?occid=133352
133381,BOL,1,,Preserved specimen,133381,147014,147014,Plantae,Chlorophyta,Ulvophyceae,Bryopsidales,Codiaceae,Codium papenfussii,26566,P.C.Silva,Codium,papenfussii,,,,,,,,,,"Anderson, R.J.",,,s.n.,,,,,,,,,,,,,,,,,,,0,,,,,,,South Africa,Western Cape,,,,Nature's Valley,0,,-33.98889,23.54639,,,,,,,,,0,0,,,,,,,,,,,unprocessed,,admin,,8/5/2022 13:03,8/5/2022 13:03,,urn:uuid:14c7debe-44f3-43cd-950a-2d0d31d3a3ac,http://test.adu.org.za/symbiota/collections/individual/index.php?occid=133381
133382,BOL,1,,Preserved specimen,133382,147015,147015,Plantae,Chlorophyta,Ulvophyceae,Bryopsidales,Codiaceae,Codium papenfussii,26566,P.C.Silva,Codium,papenfussii,,,,,,,,,,"Anderson, R.J.",,"Bolton, J.J.",s.n.,,,,,,,,,,,,,,,,,,,0,,,,,,,South Africa,Western Cape,,,,Nature's Valley,0,,-33.98889,23.54639,,,,,,,,,0,0,,,,,,,,,,,unprocessed,,admin,,8/5/2022 13:03,8/5/2022 13:03,,urn:uuid:fe74b98f-f4f0-46cb-ba9f-e0947b142535,http://test.adu.org.za/symbiota/collections/individual/index.php?occid=133382
134008,BOL,1,,Preserved specimen,134008,147647,147647,Plantae,Chlorophyta,Ulvophyceae,Ulvales,Ulvaceae,Ulva fasciata,38433,Delile,Ulva,fasciata,,,,,,,,,,"Stegenga, H.",,,s.n.,,,,,,,,,,,,,,,,,,,0,,,,,,,South Africa,Western Cape,,,,Nature's Valley,0,,-33.98889,23.54639,,,,,,,,,0,0,,,,,,,,,,,unprocessed,,admin,,8/5/2022 13:03,8/5/2022 13:03,,urn:uuid:7ffaa77e-9ac6-4224-8633-62fe539ec7b1,http://test.adu.org.za/symbiota/collections/individual/index.php?occid=134008
134202,BOL,1,,Preserved specimen,,147842,147842,Plantae,Chlorophyta,Ulvophyceae,Ulvales,Ulvaceae,Ulva,33856,,,,,,,,,,,,,"Stegenga, H.",,,s.n.,,,,,,,,,,,,,,,,,,,0,,,,,,,South Africa,Western Cape,,,,Nature's Valley (west),0,,-33.98889,23.54639,,,,,,,,,0,0,,,,,,,,,,,unprocessed,,admin,,8/5/2022 13:03,11/16/2021 0:00,,urn:uuid:3878bbb3-b213-4990-9a90-aaade3742a32,http://test.adu.org.za/symbiota/collections/individual/index.php?occid=134202
99647,BOL,1,,Preserved specimen,99647,109440,109440,Plantae,Bryophyta,Polytrichopsida,Polytrichales,Polytrichaceae,Oligotrichum,25941,,,,,,,,,,,,,"Hedderson, T.A.J.",,,14147,9/7/2001,2001,9,7,,,,,IN CREVICES OF CRUMBLING GRANITE.,,,,,,,,,,0,,,,,,,South Africa,Western Cape,,,,JONKERSHOEK. MT. FYNBOS ON TABLE MT. SANDSTONES ON W. SIDE OF VALLEY.,0,,-33.98722,18.94167,,,,,,,,,800,800,,,,,,,,,,,unprocessed,,admin,,8/5/2022 13:03,8/5/2022 13:03,,urn:uuid:5f34df2d-81e1-480c-916b-87be922f1f06,http://test.adu.org.za/symbiota/collections/individual/index.php?occid=99647
127044,BOL,1,,Preserved specimen,,140645,140645,Plantae,Bryophyta,Bryopsida,Dicranales,Leucobryaceae,Campylopus atroluteus,26385,(Mull.Hal.) Paris,Campylopus,atroluteus,,,,,,,,,,"Hedderson, T.A.J.",,,14134,9/7/2001,2001,9,7,250,,,,MT. FYNBOS ON TABLE MT. SANDSTONES ON W. SIDE OF VALLEY. ON WET ROCK ON DRIPPING CLIFF.,,,,,,,,,,0,,,,,,,South Africa,Western Cape,,,,"CAPE, JONKERSHOEK.",0,,-33.98722,18.94167,,,,,,,,,800,800,,,,,,,,,,,unprocessed,,admin,,8/5/2022 13:03,11/16/2021 0:00,,urn:uuid:b50900e8-aa01-46f5-b301-316f9a631d73,http://test.adu.org.za/symbiota/collections/individual/index.php?occid=127044
132413,BOL,1,,Preserved specimen,,146023,146023,Plantae,Chlorophyta,Ulvophyceae,Bryopsidales,Bryopsidaceae,Bryopsis,33636,,,,,,,,,,,,,"Stegenga, H.",,,s.n.,,,,,,,,,,,,,,,,,,,0,,,,,,,South Africa,Western Cape,,,,Oudekraal,0,,-33.98333,18.35,,,,,,,,,0,0,,,,,,,,,,,unprocessed,,admin,,8/5/2022 13:03,11/16/2021 0:00,,urn:uuid:bac6f2c4-97f3-4532-9f26-f344b51743c7,http://test.adu.org.za/symbiota/collections/individual/index.php?occid=132413
132831,BOL,1,,Preserved specimen,,146452,146452,Plantae,Chlorophyta,Ulvophyceae,Bryopsidales,Udoteaceae,Chlorodesmis,33648,,,,,,,,,,,,,"Anderson, R.J.",,,s.n.,,,,,,,,,,,,,,,,,,,0,,,,,,,South Africa,Western Cape,,,,Ouderkraal Cape Peninsula,0,,-33.98333,18.35,,,,,,,,,0,0,,,,,,,,,,,unprocessed,,admin,,8/5/2022 13:03,11/16/2021 0:00,,urn:uuid:f9a3105f-6907-4145-9b30-ee42e342e97c,http://test.adu.org.za/symbiota/collections/individual/index.php?occid=132831
132980,BOL,1,,Preserved specimen,,146605,146605,Plantae,Chlorophyta,Ulvophyceae,Cladophorales,Cladophoraceae,Cladophora mirabilis,73575,(C.Agardh) Rabenh.,Cladophora,mirabilis,,,,,,,,,,"Simons, R.H.",,,s.n.,,,,,,,,,,,,,,,,,,,0,,,,,,,South Africa,Western Cape,,,,Ouderkraal Cape Peninsula,0,,-33.98333,18.35,,,,,,,,,0,0,,,,,,,,,,,unprocessed,,admin,,8/5/2022 13:03,11/16/2021 0:00,,urn:uuid:381d139f-5934-4815-8b5a-31bb000bcf4c,http://test.adu.org.za/symbiota/collections/individual/index.php?occid=132980
133384,BOL,1,,Preserved specimen,133384,147017,147017,Plantae,Chlorophyta,Ulvophyceae,Bryopsidales,Codiaceae,Codium papenfussii,26566,P.C.Silva,Codium,papenfussii,,,,,,,,,,"Simons, R.H.",,,s.n.,,,,,,,,,,,,,,,,,,,0,,,,,,,South Africa,Western Cape,,,,Oudekraal  Cape Peninsula,0,,-33.98333,18.35,,,,,,,,,0,0,,,,,,,,,,,unprocessed,,admin,,8/5/2022 13:03,8/5/2022 13:03,,urn:uuid:58a0633d-431b-4f5e-9862-a2eb767d9a61,http://test.adu.org.za/symbiota/collections/individual/index.php?occid=133384
133620,BOL,1,,Preserved specimen,133620,147254,147254,Plantae,Chlorophyta,Ulvophyceae,Ulvales,Ulvaceae,Enteromorpha atroviridis,111473,(Levring) M.J.Wynne,Enteromorpha,atroviridis,,,,,,,,,,"Stegenga, H.",,,s.n.,,,,,,,,,,,,,,,,,,,0,,,,,,,South Africa,Western Cape,,,,Oudekraal  Cape Peninsula,0,,-33.98333,18.35,,,,,,,,,0,0,,,,,,,,,,,unprocessed,,admin,,8/5/2022 13:03,8/5/2022 13:03,,urn:uuid:829d5b4f-5e9e-4b21-92df-a684d962411a,http://test.adu.org.za/symbiota/collections/individual/index.php?occid=133620
133925,BOL,1,,Preserved specimen,,147564,147564,Plantae,Chlorophyta,Ulvophyceae,Ulvales,Ulvaceae,Ulva capensis,109321,Aresch.,Ulva,capensis,,,,,,,,,,"Bolton, J.J.",,,s.n.,,,,,,,,,,,,,,,,,,,0,,,,,,,South Africa,Western Cape,,,,Oudekraal,0,,-33.98333,18.35,,,,,,,,,0,0,,,,,,,,,,,unprocessed,,admin,,8/5/2022 13:03,11/16/2021 0:00,,urn:uuid:4c3e445a-6094-4fcd-8cf4-e30a5126c1d1,http://test.adu.org.za/symbiota/collections/individual/index.php?occid=133925
133939,BOL,1,,Preserved specimen,,147578,147578,Plantae,Chlorophyta,Ulvophyceae,Ulvales,Ulvaceae,Ulva capensis,109321,Aresch.,Ulva,capensis,,,,,,,,,,"Bolton, J.J.",,,s.n.,,,,,,,,,,,,,,,,,,,0,,,,,,,South Africa,Western Cape,,,,Oudekraal,0,,-33.98333,18.35,,,,,,,,,0,0,,,,,,,,,,,unprocessed,,admin,,8/5/2022 13:03,11/16/2021 0:00,,urn:uuid:040cf3ba-c866-4983-91a4-2e6f5b355ee0,http://test.adu.org.za/symbiota/collections/individual/index.php?occid=133939
133943,BOL,1,,Preserved specimen,,147582,147582,Plantae,Chlorophyta,Ulvophyceae,Ulvales,Ulvaceae,Ulva capensis,109321,Aresch.,Ulva,capensis,,,,,,,,,,"Stegenga, H.",,,s.n.,,,,,,,,,,,,,,,,,,,0,,,,,,,South Africa,Western Cape,,,,Oudekraal Cape Peninsula,0,,-33.98333,18.35,,,,,,,,,0,0,,,,,,,,,,,unprocessed,,admin,,8/5/2022 13:03,11/16/2021 0:00,,urn:uuid:591631fb-1844-4b25-8928-3766f4229ce9,http://test.adu.org.za/symbiota/collections/individual/index.php?occid=133943
134137,BOL,1,,Preserved specimen,,147777,147777,Plantae,Chlorophyta,Ulvophyceae,Ulvales,Ulvaceae,Ulva capensis,109321,Aresch.,Ulva,capensis,,,,,,,,,,"Joska, M.A.P.",,,s.n.,,,,,,,,,,,,,,,,,,,0,,,,,,,South Africa,Western Cape,,,,Oudekraal,0,,-33.98333,18.35,,,,,,,,,0,0,,,,,,,,,,,unprocessed,,admin,,8/5/2022 13:03,11/16/2021 0:00,,urn:uuid:dda8b32a-4082-4b6b-b10b-9bb2dc1b4dce,http://test.adu.org.za/symbiota/collections/individual/index.php?occid=134137
127305,BOL,1,,Preserved specimen,,140906,140906,Plantae,Bryophyta,Bryopsida,Hypnales,Sematophyllaceae,Sematophyllum,33826,,,,,,,,,,,,,"Hedderson, T.A.J.",,,14159,9/7/2001,2001,9,7,250,,,,MT. FYNBOS ON TABLE MT. SANDSTONES ON W. SIDE OF VALLEY. ON ROCKS IN SPRAY OF WATERFALL.,,,,,,,,,,0,,,,,,,South Africa,Western Cape,,,,"CAPE, JONKERSHOEK.",0,,-33.98333,18.94167,,,,,,,,,800,800,,,,,,,,,,,unprocessed,,admin,,8/5/2022 13:03,11/16/2021 0:00,,urn:uuid:0e0d4dc7-551d-40e1-8e3b-4c20ffeeb3e9,http://test.adu.org.za/symbiota/collections/individual/index.php?occid=127305
99641,BOL,1,,Preserved specimen,99641,109434,109434,Plantae,Bryophyta,Polytrichopsida,Polytrichales,Polytrichaceae,Oligotrichum,25941,,,,,,,,,,,,,"Hedderson, T.A.J.",,,13010,1/29/2000,2000,1,29,,,,,ON SOIL ALONG PATH.,,,,,,,,,,0,,,,,,,South Africa,Western Cape,,,,JONKERSKOEK. ALONG PANORAMA PATH TO HEAD OF VALLEY. PATH ON E. SIDE OF VALLEY.,0,,-33.98333,18.95,,,,,,,,,1000,1000,,,,,,,,,,,unprocessed,,admin,,8/5/2022 13:03,8/5/2022 13:03,,urn:uuid:00e3f1be-46f6-47a0-a69e-11ac3fb481d4,http://test.adu.org.za/symbiota/collections/individual/index.php?occid=99641
127144,BOL,1,,Preserved specimen,,140745,140745,Plantae,Bryophyta,Bryopsida,Hypnales,Hypnaceae,Isopterygium,33709,,,,,,,,,,,,,"Hedderson, T.A.J.",,,13035,1/29/2000,2000,1,29,29,,,,"W. SIDE OF VALLEY, FORESTED MARGIN OF STREAM. SOIL ALONG STREAM.",,,,,,,,,,0,,,,,,,South Africa,Western Cape,,,,"CAPE, JONKERSHOEK. ALONG PANORAMA PATH TO HEAD OF VALLEY.",0,,-33.98333,18.95,,,,,,,,,800,800,,,,,,,,,,,unprocessed,,admin,,8/5/2022 13:03,11/16/2021 0:00,,urn:uuid:54706dbc-7252-4521-8bb6-66d4a40a207a,http://test.adu.org.za/symbiota/collections/individual/index.php?occid=127144
127299,BOL,1,,Preserved specimen,,140900,140900,Plantae,Bryophyta,Bryopsida,Hypnales,Sematophyllaceae,Sematophyllum,33826,,,,,,,,,,,,,"Hedderson, T.A.J.",,,13028,1/29/2000,2000,1,29,29,,,,"E. SIDE OF VALLEY, ON MARGIN OF SMALL STREAM WITH FOREST COVER. ABUNDANT ON WET ROCK.",,,,,,,,,,0,,,,,,,South Africa,Western Cape,,,,"CAPE, JONKERSHOEK. ALONG PANORAMA PATH TO HEAD OF VALLEY.",0,,-33.98333,18.95,,,,,,,,,1100,1100,,,,,,,,,,,unprocessed,,admin,,8/5/2022 13:03,11/16/2021 0:00,,urn:uuid:7bcaa8c6-5bb2-4d5b-aa16-cbfd0644ddd4,http://test.adu.org.za/symbiota/collections/individual/index.php?occid=127299
133715,BOL,1,,Preserved specimen,,147351,147351,Plantae,Chlorophyta,Ulvophyceae,Ulvales,Ulvaceae,Enteromorpha prolifera,111480,(O.F.Mull.) J.Agardh,Enteromorpha,prolifera,,,,,,,,,,"Joska, M.A.P.",,,s.n.,,,,,,,,,,,,,,,,,,,0,,,,,,,South Africa,Western Cape,,,,Berg River estuary Diz Plaat(?)-illegible,0,,-33.98333,19.06667,,,,,,,,,0,0,,,,,,,,,,,unprocessed,,admin,,8/5/2022 13:03,11/16/2021 0:00,,urn:uuid:24a3fcc0-31fe-4a65-8978-c5fa37c5cef8,http://test.adu.org.za/symbiota/collections/individual/index.php?occid=133715
133066,BOL,1,,Preserved specimen,,146695,146695,Plantae,Chlorophyta,Ulvophyceae,Cladophorales,Cladophoraceae,Cladophora radiosa,73577,(Suhr) Kutz.,Cladophora,radiosa,,,,,,,,,,"Bolton, J.J.",,"Stegenga, H",s.n.,,,,,,,,,,,,,,,,,,,0,,,,,,,South Africa,Western Cape,,,,Nature's Valley Blue Rocks,0,,-33.98333,23.55,,,,,,,,,0,0,,,,,,,,,,,unprocessed,,admin,,8/5/2022 13:03,11/16/2021 0:00,,urn:uuid:f15b3ba2-bd40-4cdb-8624-d3bd580adaa2,http://test.adu.org.za/symbiota/collections/individual/index.php?occid=133066
133719,BOL,1,,Preserved specimen,,147355,147355,Plantae,Chlorophyta,Ulvophyceae,Ulvales,Ulvaceae,Enteromorpha prolifera,111480,(O.F.Mull.) J.Agardh,Enteromorpha,prolifera,,,,,,,,,,"Bolton, J.J.",,"Stegenga, H",s.n.,,,,,,,,,,,,,,,,,,,0,,,,,,,South Africa,Western Cape,,,,Nature's Valley Blue Rocks,0,,-33.98333,23.55,,,,,,,,,0,0,,,,,,,,,,,unprocessed,,admin,,8/5/2022 13:03,11/16/2021 0:00,,urn:uuid:25995688-8fd4-43c4-8c22-52c102864e26,http://test.adu.org.za/symbiota/collections/individual/index.php?occid=133719
134237,BOL,1,,Preserved specimen,,147877,147877,Plantae,Chlorophyta,Ulvophyceae,Ulvales,Ulvaceae,Ulva,33856,,,,,,,,,,,,,"Bolton, J.J.",,"Stegenga, H",s.n.,,,,,,,,,,,,,,,,,,,0,,,,,,,South Africa,Western Cape,,,,Nature's Valley Blue Rocks,0,,-33.98333,23.55,,,,,,,,,0,0,,,,,,,,,,,unprocessed,,admin,,8/5/2022 13:03,11/16/2021 0:00,,urn:uuid:33545eb5-4c0b-4f19-8f66-864f01ab1a38,http://test.adu.org.za/symbiota/collections/individual/index.php?occid=134237
16785,BOL,1,,Preserved specimen,16785,18113,18113,Plantae,Rhodophyta,Florideophyceae,Plocamiales,Plocamiaceae,Plocamium corallorhiza,,(Turner) J.D.Hooker & Harvey,,,,,,,,,,,,"Van Bosse, A.W.",,,s.n.,1894-10-01,1894,10,1,,,,,,,,,,,,,,,0,,,,,,,South Africa,Eastern Cape,Hogsback,,,"Capland, Port Elizabeth",0,,-33.98333,25.67139,,,,,,,,,0,0,,,,,,,,,,,unprocessed,,admin,,8/5/2022 13:03,8/5/2022 13:03,,urn:uuid:e2c63436-1779-4180-a9e6-1900164795c1,http://test.adu.org.za/symbiota/collections/individual/index.php?occid=16785
133275,BOL,1,,Preserved specimen,133275,146906,146906,Plantae,Chlorophyta,Ulvophyceae,Bryopsidales,Codiaceae,Codium extricatum,26561,P.C.Silva,Codium,extricatum,,,,,,,,,,"Stegenga, H.",,,s.n.,,,,,,,,,,,,,,,,,,,0,,,,,,,South Africa,Eastern Cape,Hogsback,,,Port Elizabeth  Summerstrand,0,,-33.98278,25.66667,,,,,,,,,0,0,,,,,,,,,,,unprocessed,,admin,,8/5/2022 13:03,8/5/2022 13:03,,urn:uuid:474e686c-3fd0-4148-a391-a438795cabef,http://test.adu.org.za/symbiota/collections/individual/index.php?occid=133275
133422,BOL,1,,Preserved specimen,,147055,147055,Plantae,Chlorophyta,Ulvophyceae,Bryopsidales,Codiaceae,Codium platylobium,26568,Aresch.,Codium,platylobium,,,,,,,,,,"Steyn, WJG",,,s.n.,,,,,,,,,,,,,,,,,,,0,,,,,,,South Africa,Eastern Cape,Hogsback,,,Port Elizabeth Summerstrand,0,,-33.98278,25.66667,,,,,,,,,0,0,,,,,,,,,,,unprocessed,,admin,,8/5/2022 13:03,11/9/2021 0:00,,urn:uuid:c1ab19c1-7a4b-4b0b-9440-2fa4092c3746,http://test.adu.org.za/symbiota/collections/individual/index.php?occid=133422
127297,BOL,1,,Preserved specimen,,140898,140898,Plantae,Bryophyta,Bryopsida,Hypnales,Sematophyllaceae,Sematophyllum,33826,,,,,,,,,,,,,"Hedderson, T.A.J.",,,13375,10/27/2000,2000,10,27,301,,,,S.- FACING SANDSTONE CLIFFS. MATS ON SHADED ROCK ALONG RIDGE.,,,,,,,,,,0,,,,,,,South Africa,Western Cape,,,,"CAPE PEN., CAPE TOWN. TABLE MT., PATH ALONG S. SIDE OF RIDGE BETW ECHO VALLEY & VALLEY OF ISOLATION.",0,,-33.97222,18.41083,,,,,,,,,900,900,,,,,,,,,,,unprocessed,,admin,,8/5/2022 13:03,11/16/2021 0:00,,urn:uuid:902269d4-2171-46a8-afc5-f78bba066f2d,http://test.adu.org.za/symbiota/collections/individual/index.php?occid=127297
132881,BOL,1,,Preserved specimen,132881,146502,146502,Plantae,Chlorophyta,Ulvophyceae,Cladophorales,Cladophoraceae,Cladophora capensis,37893,(C.Agardh) De Toni,Cladophora,capensis,,,,,,,,,,Ass. Divers C.T.,,,s.n.,,,,,,,,,,,,,,,,,,,0,,,,,,,South Africa,Western Cape,,,,Bakoven  Cape Peninsula,0,,-33.96667,18.38333,,,,,,,,,0,0,,,,,,,,,,,unprocessed,,admin,,8/5/2022 13:03,8/5/2022 13:03,,urn:uuid:4fbe905a-d074-4ac7-b492-fd6d7dc1da14,http://test.adu.org.za/symbiota/collections/individual/index.php?occid=132881
132987,BOL,1,,Preserved specimen,,146612,146612,Plantae,Chlorophyta,Ulvophyceae,Cladophorales,Cladophoraceae,Cladophora mirabilis,73575,(C.Agardh) Rabenh.,Cladophora,mirabilis,,,,,,,,,,Ass. Divers C.T.,,,s.n.,,,,,,,,,,,,,,,,,,,0,,,,,,,South Africa,Western Cape,,,,Bakoven Cape Peninsula,0,,-33.96667,18.38333,,,,,,,,,0,0,,,,,,,,,,,unprocessed,,admin,,8/5/2022 13:03,11/16/2021 0:00,,urn:uuid:b4102acb-ca31-4e64-a7ea-a6a37cbc7da6,http://test.adu.org.za/symbiota/collections/individual/index.php?occid=132987
133092,BOL,1,,Preserved specimen,,146721,146721,Plantae,Chlorophyta,Ulvophyceae,Cladophorales,Cladophoraceae,Cladophora radiosa,73577,(Suhr) Kutz.,Cladophora,radiosa,,,,,,,,,,"Simons, R.H.",,,s.n.,,,,,,,,,,,,,,,,,,,0,,,,,,,South Africa,Western Cape,,,,Bakoven Cape Peninsula,0,,-33.96667,18.38333,,,,,,,,,0,0,,,,,,,,,,,unprocessed,,admin,,8/5/2022 13:03,11/16/2021 0:00,,urn:uuid:0826c49d-ac82-4de5-9c16-3fac5135a4c0,http://test.adu.org.za/symbiota/collections/individual/index.php?occid=133092
133932,BOL,1,,Preserved specimen,,147571,147571,Plantae,Chlorophyta,Ulvophyceae,Ulvales,Ulvaceae,Ulva capensis,109321,Aresch.,Ulva,capensis,,,,,,,,,,"Joska, M.A.P.",,,s.n.,,,,,,,,,,,,,,,,,,,0,,,,,,,South Africa,Western Cape,,,,Bakoven Cape Peninsula,0,,-33.96667,18.38333,,,,,,,,,0,0,,,,,,,,,,,unprocessed,,admin,,8/5/2022 13:03,11/16/2021 0:00,,urn:uuid:19135ee9-c1a9-4db0-9e4b-cdeeecc4e1b4,http://test.adu.org.za/symbiota/collections/individual/index.php?occid=133932
133977,BOL,1,,Preserved specimen,,147616,147616,Plantae,Chlorophyta,Ulvophyceae,Ulvales,Ulvaceae,Ulva capensis,109321,Aresch.,Ulva,capensis,,,,,,,,,,"Simons, R.H.",,,s.n.,,,,,,,,,,,,,,,,,,,0,,,,,,,South Africa,Western Cape,,,,Bakoven Cape Peninsula,0,,-33.96667,18.38333,,,,,,,,,0,0,,,,,,,,,,,unprocessed,,admin,,8/5/2022 13:03,11/16/2021 0:00,,urn:uuid:b3914484-8662-4df5-aacd-dd50d7025a48,http://test.adu.org.za/symbiota/collections/individual/index.php?occid=133977
133423,BOL,1,,Preserved specimen,,147056,147056,Plantae,Chlorophyta,Ulvophyceae,Bryopsidales,Codiaceae,Codium platylobium,26568,Aresch.,Codium,platylobium,,,,,,,,,,"Niekerk, GM van",,,s.n.,,,,,,,,,,,,,,,,,,,0,,,,,,,South Africa,Eastern Cape,Hogsback,,,Humewood,0,,-33.96667,25.63333,,,,,,,,,0,0,,,,,,,,,,,unprocessed,,admin,,8/5/2022 13:03,11/9/2021 0:00,,urn:uuid:6a808ac3-d50a-4635-a20e-62f11af5d80e,http://test.adu.org.za/symbiota/collections/individual/index.php?occid=133423
133470,BOL,1,,Preserved specimen,133470,147104,147104,Plantae,Chlorophyta,Ulvophyceae,Bryopsidales,Codiaceae,Codium stephensiae,26572,C.I.Dickinson,Codium,stephensiae,,,,,,,,,,"Steyn, WJG",,,s.n.,,,,,,,,,,,,,,,,,,,0,,,,,,,South Africa,Eastern Cape,Hogsback,,,Humewood near Port Elizabeth,0,,-33.96667,25.63333,,,,,,,,,0,0,,,,,,,,,,,unprocessed,,admin,,8/5/2022 13:03,8/5/2022 13:03,,urn:uuid:a2c0b230-a4eb-4aa6-a5f7-e928a6a7ae36,http://test.adu.org.za/symbiota/collections/individual/index.php?occid=133470
133496,BOL,1,,Preserved specimen,,147130,147130,Plantae,Chlorophyta,Ulvophyceae,Bryopsidales,Codiaceae,Codium,20449,,,,,,,,,,,,,"Niekerk, GM van",,,s.n.,,,,,,,,,,,,,,,,,,,0,,,,,,,South Africa,Eastern Cape,Hogsback,,,Humewood,0,,-33.96667,25.63333,,,,,,,,,0,0,,,,,,,,,,,unprocessed,,admin,,8/5/2022 13:03,11/11/2021 0:00,,urn:uuid:617cf12e-5026-4428-85d1-25cdd2dc7b8c,http://test.adu.org.za/symbiota/collections/individual/index.php?occid=133496
134356,BOL,1,,Preserved specimen,,147996,147996,Plantae,Chlorophyta,Ulvophyceae,Ulvales,Ulvaceae,Ulva,33856,,,,,,,,,,,,,"Hewitt, F.E.",,,s.n.,,,,,,,,,,,,,,,,,,,0,,,,,,,South Africa,Eastern Cape,Hogsback,,,Humewood Port Elizabeth,0,,-33.96667,25.63333,,,,,,,,,0,0,,,,,,,,,,,unprocessed,,admin,,8/5/2022 13:03,11/11/2021 0:00,,urn:uuid:8cae4420-1820-47e4-bf8d-cb68286b889a,http://test.adu.org.za/symbiota/collections/individual/index.php?occid=134356
127295,BOL,1,,Preserved specimen,,140896,140896,Plantae,Bryophyta,Bryopsida,Hypnales,Sematophyllaceae,Sematophyllum,33826,,,,,,,,,,,,,"Hedderson, T.A.J.",,,13355,10/27/2000,2000,10,27,301,,,,SHALLOW VALLEY. SANDSTONE ROCK OUTCROPS WITH CLIFFORTIA & LEUCODENDRON. ON ROCKS AT BASE OF CLIFF.,,,,,,,,,,0,,,,,,,South Africa,Western Cape,,,,"CAPE PEN., CAPE TOWN. TABLE MT., SHALLOW VALLEY AT HEAD OF FOUNTAIN RAVINE.",0,,-33.96639,18.40833,,,,,,,,,1000,1000,,,,,,,,,,,unprocessed,,admin,,8/5/2022 13:03,11/16/2021 0:00,,urn:uuid:945ab6cf-eec6-4732-9555-f24b0055edf4,http://test.adu.org.za/symbiota/collections/individual/index.php?occid=127295
127298,BOL,1,,Preserved specimen,,140899,140899,Plantae,Bryophyta,Bryopsida,Hypnales,Sematophyllaceae,Sematophyllum,33826,,,,,,,,,,,,,"Hedderson, T.A.J.",,,13364,10/27/2000,2000,10,27,301,,,,SHALLOW VALLEY. SANDSTONE ROCK OUTCROPS WITH CLIFFORTIA & LEUCODENDRON. ON SHADED ROCK LEDGE.,,,,,,,,,,0,,,,,,,South Africa,Western Cape,,,,"CAPE PEN., CAPE TOWN. TABLE MT., SHALLOW VALLEY AT HEAD OF FOUNTAIN RAVINE.",0,,-33.96639,18.40833,,,,,,,,,1000,1000,,,,,,,,,,,unprocessed,,admin,,8/5/2022 13:03,11/16/2021 0:00,,urn:uuid:74992fc5-35c7-4550-ad11-968195200d76,http://test.adu.org.za/symbiota/collections/individual/index.php?occid=127298
127300,BOL,1,,Preserved specimen,,140901,140901,Plantae,Bryophyta,Bryopsida,Hypnales,Sematophyllaceae,Sematophyllum,33826,,,,,,,,,,,,,"Hedderson, T.A.J.",,,13355,10/27/2000,2000,10,27,301,,,,SHALLOW VALLEY. SANDSTONE ROCK OUTCROPS WITH CLIFFORTIA & LEUCODENDRON. ON ROCK AT BASE OF CLIFF.,,,,,,,,,,0,,,,,,,South Africa,Western Cape,,,,"CAPE PEN., CAPE TOWN. TABLE MT., SHALLOW VALLEY AT HEAD OF FOUNTAIN RAVINE.",0,,-33.96639,18.40833,,,,,,,,,1000,1000,,,,,,,,,,,unprocessed,,admin,,8/5/2022 13:03,11/16/2021 0:00,,urn:uuid:c3204f57-2679-413e-a897-59edad6afffc,http://test.adu.org.za/symbiota/collections/individual/index.php?occid=127300
99648,BOL,1,,Preserved specimen,99648,109441,109441,Plantae,Bryophyta,Polytrichopsida,Polytrichales,Polytrichaceae,Pogonatum capense,28276,(Hampe) A.Jaeger,Pogonatum,capense,,,,,,,,,,"Hedderson, T.A.J.",,,13004,1/15/2000,2000,1,15,,,,,"ON VERTICAL, SHADED ROADCUT BANK.",,,,,,,,,,0,,,,,,,South Africa,Western Cape,,,,CAPE TOWN. SLOPES ABOVE U. C. T. ON CONTOUR PATH BETWEEN KINGS BLOCKHOUSE & NEWLANDS RESERVOIR.,0,,-33.95917,18.45278,,,,,,,,,270,270,,,,,,,,,,,unprocessed,,admin,,8/5/2022 13:03,8/5/2022 13:03,,urn:uuid:1b62273f-d956-42d4-8448-3a6bbe996195,http://test.adu.org.za/symbiota/collections/individual/index.php?occid=99648
132427,BOL,1,,Preserved specimen,,146037,146037,Plantae,Chlorophyta,Ulvophyceae,Bryopsidales,Bryopsidaceae,Bryopsis,33636,,,,,,,,,,,,,"Michell, M.R.B.",,,s.n.,,,,,,,,,,,,,,,,,,,0,,,,,,,South Africa,Western Cape,,,,Camps Bay,0,,-33.95,18.375,,,,,,,,,0,0,,,,,,,,,,,unprocessed,,admin,,8/5/2022 13:03,11/16/2021 0:00,,urn:uuid:46cac4c2-c530-4789-8092-9b197647c5d4,http://test.adu.org.za/symbiota/collections/individual/index.php?occid=132427
132436,BOL,1,,Preserved specimen,,146046,146046,Plantae,Chlorophyta,Ulvophyceae,Bryopsidales,Bryopsidaceae,Bryopsis,33636,,,,,,,,,,,,,"Simons, R.H.",,,s.n.,,,,,,,,,,,,,,,,,,,0,,,,,,,South Africa,Western Cape,,,,Camps Bay,0,,-33.95,18.375,,,,,,,,,0,0,,,,,,,,,,,unprocessed,,admin,,8/5/2022 13:03,11/16/2021 0:00,,urn:uuid:3e233493-b9f1-4e80-be2f-02f0480b1cee,http://test.adu.org.za/symbiota/collections/individual/index.php?occid=132436
132437,BOL,1,,Preserved specimen,,146047,146047,Plantae,Chlorophyta,Ulvophyceae,Bryopsidales,Bryopsidaceae,Bryopsis,33636,,,,,,,,,,,,,"Simons, R.H.",,,s.n.,,,,,,,,,,,,,,,,,,,0,,,,,,,South Africa,Western Cape,,,,Camps Bay,0,,-33.95,18.375,,,,,,,,,0,0,,,,,,,,,,,unprocessed,,admin,,8/5/2022 13:03,11/16/2021 0:00,,urn:uuid:66b62467-e26c-438f-870c-697e0263b7ff,http://test.adu.org.za/symbiota/collections/individual/index.php?occid=132437
132438,BOL,1,,Preserved specimen,,146048,146048,Plantae,Chlorophyta,Ulvophyceae,Bryopsidales,Bryopsidaceae,Bryopsis,33636,,,,,,,,,,,,,"Simons, R.H.",,,s.n.,,,,,,,,,,,,,,,,,,,0,,,,,,,South Africa,Western Cape,,,,Camps Bay,0,,-33.95,18.375,,,,,,,,,0,0,,,,,,,,,,,unprocessed,,admin,,8/5/2022 13:03,11/16/2021 0:00,,urn:uuid:1f37c27c-637d-436b-b437-f428721e2eee,http://test.adu.org.za/symbiota/collections/individual/index.php?occid=132438
132439,BOL,1,,Preserved specimen,,146049,146049,Plantae,Chlorophyta,Ulvophyceae,Bryopsidales,Bryopsidaceae,Bryopsis,33636,,,,,,,,,,,,,"Simons, R.H.",,,s.n.,,,,,,,,,,,,,,,,,,,0,,,,,,,South Africa,Western Cape,,,,Camps Bay,0,,-33.95,18.375,,,,,,,,,0,0,,,,,,,,,,,unprocessed,,admin,,8/5/2022 13:03,11/16/2021 0:00,,urn:uuid:aba5da7b-eb1e-418d-8774-5a1e564d4f3d,http://test.adu.org.za/symbiota/collections/individual/index.php?occid=132439
132440,BOL,1,,Preserved specimen,,146050,146050,Plantae,Chlorophyta,Ulvophyceae,Bryopsidales,Bryopsidaceae,Bryopsis,33636,,,,,,,,,,,,,"Simons, R.H.",,,s.n.,,,,,,,,,,,,,,,,,,,0,,,,,,,South Africa,Western Cape,,,,Camps Bay,0,,-33.95,18.375,,,,,,,,,0,0,,,,,,,,,,,unprocessed,,admin,,8/5/2022 13:03,11/16/2021 0:00,,urn:uuid:f82d12cd-5817-48a8-8514-9acde2f651b1,http://test.adu.org.za/symbiota/collections/individual/index.php?occid=132440
132441,BOL,1,,Preserved specimen,,146051,146051,Plantae,Chlorophyta,Ulvophyceae,Bryopsidales,Bryopsidaceae,Bryopsis,33636,,,,,,,,,,,,,"Simons, R.H.",,,s.n.,,,,,,,,,,,,,,,,,,,0,,,,,,,South Africa,Western Cape,,,,Camps Bay,0,,-33.95,18.375,,,,,,,,,0,0,,,,,,,,,,,unprocessed,,admin,,8/5/2022 13:03,11/16/2021 0:00,,urn:uuid:efee3eaa-369e-4a4f-aeba-e9a99c0990dd,http://test.adu.org.za/symbiota/collections/individual/index.php?occid=132441
132442,BOL,1,,Preserved specimen,,146052,146052,Plantae,Chlorophyta,Ulvophyceae,Bryopsidales,Bryopsidaceae,Bryopsis,33636,,,,,,,,,,,,,"Simons, R.H.",,,s.n.,,,,,,,,,,,,,,,,,,,0,,,,,,,South Africa,Western Cape,,,,Camps Bay,0,,-33.95,18.375,,,,,,,,,0,0,,,,,,,,,,,unprocessed,,admin,,8/5/2022 13:03,11/16/2021 0:00,,urn:uuid:91450716-e29a-422c-818e-a80350b335b6,http://test.adu.org.za/symbiota/collections/individual/index.php?occid=132442
132447,BOL,1,,Preserved specimen,,146057,146057,Plantae,Chlorophyta,Ulvophyceae,Bryopsidales,Bryopsidaceae,Bryopsis,33636,,,,,,,,,,,,,"Simons, R.H.",,,s.n.,,,,,,,,,,,,,,,,,,,0,,,,,,,South Africa,Western Cape,,,,Camps Bay,0,,-33.95,18.375,,,,,,,,,0,0,,,,,,,,,,,unprocessed,,admin,,8/5/2022 13:03,11/16/2021 0:00,,urn:uuid:41feb66e-0167-4566-b29d-207e546656e6,http://test.adu.org.za/symbiota/collections/individual/index.php?occid=132447
132497,BOL,1,,Preserved specimen,,146108,146108,Plantae,Chlorophyta,Ulvophyceae,Bryopsidales,Bryopsidaceae,Bryopsis,33636,,,,,,,,,,,,,"Simons, R.H.",,,s.n.,,,,,,,,,,,,,,,,,,,0,,,,,,,South Africa,Western Cape,,,,Camps Bay,0,,-33.95,18.375,,,,,,,,,0,0,,,,,,,,,,,unprocessed,,admin,,8/5/2022 13:03,11/16/2021 0:00,,urn:uuid:327afa00-bcdc-43dd-9ec4-b4e658f7a699,http://test.adu.org.za/symbiota/collections/individual/index.php?occid=132497
132498,BOL,1,,Preserved specimen,,146109,146109,Plantae,Chlorophyta,Ulvophyceae,Bryopsidales,Bryopsidaceae,Bryopsis,33636,,,,,,,,,,,,,"Simons, R.H.",,,s.n.,,,,,,,,,,,,,,,,,,,0,,,,,,,South Africa,Western Cape,,,,Camps Bay,0,,-33.95,18.375,,,,,,,,,0,0,,,,,,,,,,,unprocessed,,admin,,8/5/2022 13:03,11/16/2021 0:00,,urn:uuid:ebd4b91d-ae08-4e45-861e-f876d030accf,http://test.adu.org.za/symbiota/collections/individual/index.php?occid=132498
132499,BOL,1,,Preserved specimen,,146110,146110,Plantae,Chlorophyta,Ulvophyceae,Bryopsidales,Bryopsidaceae,Bryopsis,33636,,,,,,,,,,,,,"Simons, R.H.",,,s.n.,,,,,,,,,,,,,,,,,,,0,,,,,,,South Africa,Western Cape,,,,Camps Bay,0,,-33.95,18.375,,,,,,,,,0,0,,,,,,,,,,,unprocessed,,admin,,8/5/2022 13:03,11/16/2021 0:00,,urn:uuid:e3ccda58-92da-4c5d-ae94-8876782efda5,http://test.adu.org.za/symbiota/collections/individual/index.php?occid=132499
132796,BOL,1,,Preserved specimen,,146411,146411,Plantae,Chlorophyta,Ulvophyceae,Cladophorales,Cladophoraceae,Chaetomorpha robusta,37883,(Aresch.) Papenf.,Chaetomorpha,robusta,,,,,,,,,,"Paine, R",,,s.n.,,,,,,,,,,,,,,,,,,,0,,,,,,,South Africa,Western Cape,,,,Camps Bay Sea Point (Table Bay),0,,-33.95,18.375,,,,,,,,,0,0,,,,,,,,,,,unprocessed,,admin,,8/5/2022 13:03,11/16/2021 0:00,,urn:uuid:6b4cff00-fe9e-498a-927b-db67b9989b0f,http://test.adu.org.za/symbiota/collections/individual/index.php?occid=132796
132915,BOL,1,,Preserved specimen,,146539,146539,Plantae,Chlorophyta,Ulvophyceae,Cladophorales,Cladophoraceae,Cladophora flagelliformis,37897,(Suhr) Kutz.,Cladophora,flagelliformis,,,,,,,,,,"Noble, R.G.",,,s.n.,,,,,,,,,,,,,,,,,,,0,,,,,,,South Africa,Western Cape,,,,Camps Bay,0,,-33.95,18.375,,,,,,,,,0,0,,,,,,,,,,,unprocessed,,admin,,8/5/2022 13:03,11/16/2021 0:00,,urn:uuid:59f58add-f4aa-458c-af98-484c01d1f3c9,http://test.adu.org.za/symbiota/collections/individual/index.php?occid=132915
133154,BOL,1,,Preserved specimen,,146784,146784,Plantae,Chlorophyta,Ulvophyceae,Cladophorales,Cladophoraceae,Cladophora,33651,,,,,,,,,,,,,Unknown,,,s.n.,,,,,,,,,,,,,,,,,,,0,,,,,,,South Africa,Western Cape,,,,Camps Bay,0,,-33.95,18.375,,,,,,,,,0,0,,,,,,,,,,,unprocessed,,admin,,8/5/2022 13:03,11/16/2021 0:00,,urn:uuid:d920b409-f94d-49d1-9f4f-2411eeaecc71,http://test.adu.org.za/symbiota/collections/individual/index.php?occid=133154
133155,BOL,1,,Preserved specimen,,146785,146785,Plantae,Chlorophyta,Ulvophyceae,Cladophorales,Cladophoraceae,Cladophora,33651,,,,,,,,,,,,,"De Toui, A.B.",,,s.n.,,,,,,,,,,,,,,,,,,,0,,,,,,,South Africa,Western Cape,,,,Camps Bay,0,,-33.95,18.375,,,,,,,,,0,0,,,,,,,,,,,unprocessed,,admin,,8/5/2022 13:03,11/16/2021 0:00,,urn:uuid:d757cef4-c9b7-472e-87d6-ee250c695ff3,http://test.adu.org.za/symbiota/collections/individual/index.php?occid=133155
133160,BOL,1,,Preserved specimen,,146790,146790,Plantae,Chlorophyta,Ulvophyceae,Cladophorales,Cladophoraceae,Cladophora,33651,,,,,,,,,,,,,Unknown,,,s.n.,,,,,,,,,,,,,,,,,,,0,,,,,,,South Africa,Western Cape,,,,Camps Bay,0,,-33.95,18.375,,,,,,,,,0,0,,,,,,,,,,,unprocessed,,admin,,8/5/2022 13:03,11/16/2021 0:00,,urn:uuid:4ee8d6b3-354d-4052-b1c7-46503b4881f0,http://test.adu.org.za/symbiota/collections/individual/index.php?occid=133160
133258,BOL,1,,Preserved specimen,133258,146889,146889,Plantae,Chlorophyta,Ulvophyceae,Bryopsidales,Codiaceae,Codium duthieae,26560,P.C.Silva,Codium,duthieae,,,,,,,,,,Unknown,,,s.n.,,,,,,,,,,,,,,,,,,,0,,,,,,,South Africa,Western Cape,,,,Camps Bay,0,,-33.95,18.375,,,,,,,,,0,0,,,,,,,,,,,unprocessed,,admin,,8/5/2022 13:03,8/5/2022 13:03,,urn:uuid:10c321b4-fba8-4a04-949e-0603f1b722c2,http://test.adu.org.za/symbiota/collections/individual/index.php?occid=133258
133603,BOL,1,,Preserved specimen,,147237,147237,Plantae,Chlorophyta,Ulvophyceae,Bryopsidales,Derbesiaceae,Derbesia lamourouxi,117352,(J.Agardh) Solier,Derbesia,lamourouxi,,,,,,,,,,"Simons, R.H.",,,s.n.,,,,,,,,,,,,,,,,,,,0,,,,,,,South Africa,Western Cape,,,,Camps Bay,0,,-33.95,18.375,,,,,,,,,0,0,,,,,,,,,,,unprocessed,,admin,,8/5/2022 13:03,11/16/2021 0:00,,urn:uuid:2067d66b-6f7a-4f5b-8f50-3fc6d6d50bf9,http://test.adu.org.za/symbiota/collections/individual/index.php?occid=133603
133604,BOL,1,,Preserved specimen,,147238,147238,Plantae,Chlorophyta,Ulvophyceae,Bryopsidales,Derbesiaceae,Derbesia lamourouxi,117352,(J.Agardh) Solier,Derbesia,lamourouxi,,,,,,,,,,"Simons, R.H.",,,s.n.,,,,,,,,,,,,,,,,,,,0,,,,,,,South Africa,Western Cape,,,,Camps Bay,0,,-33.95,18.375,,,,,,,,,0,0,,,,,,,,,,,unprocessed,,admin,,8/5/2022 13:03,11/16/2021 0:00,,urn:uuid:3d898665-460b-4655-8a8b-eb9e638c157c,http://test.adu.org.za/symbiota/collections/individual/index.php?occid=133604
133605,BOL,1,,Preserved specimen,,147239,147239,Plantae,Chlorophyta,Ulvophyceae,Bryopsidales,Derbesiaceae,Derbesia lamourouxi,117352,(J.Agardh) Solier,Derbesia,lamourouxi,,,,,,,,,,"Simons, R.H.",,,s.n.,,,,,,,,,,,,,,,,,,,0,,,,,,,South Africa,Western Cape,,,,Camps Bay,0,,-33.95,18.375,,,,,,,,,0,0,,,,,,,,,,,unprocessed,,admin,,8/5/2022 13:03,11/16/2021 0:00,,urn:uuid:b8aac3de-11de-404e-b402-b5bcf4072b74,http://test.adu.org.za/symbiota/collections/individual/index.php?occid=133605
133750,BOL,1,,Preserved specimen,,147386,147386,Plantae,Chlorophyta,Ulvophyceae,Ulvales,Ulvaceae,Enteromorpha,107259,,,,,,,,,,,,,"Michell, M.R.B.",,,s.n.,,,,,,,,,,,,,,,,,,,0,,,,,,,South Africa,Western Cape,,,,Camps Bay,0,,-33.95,18.375,,,,,,,,,0,0,,,,,,,,,,,unprocessed,,admin,,8/5/2022 13:03,11/16/2021 0:00,,urn:uuid:8942e485-4d57-4b58-8db8-07df30296f48,http://test.adu.org.za/symbiota/collections/individual/index.php?occid=133750
133769,BOL,1,,Preserved specimen,,147405,147405,Plantae,Chlorophyta,Ulvophyceae,Ulvales,Ulvaceae,Enteromorpha,107259,,,,,,,,,,,,,Unknown,,,s.n.,,,,,,,,,,,,,,,,,,,0,,,,,,,South Africa,Western Cape,,,,Camps Bay,0,,-33.95,18.375,,,,,,,,,0,0,,,,,,,,,,,unprocessed,,admin,,8/5/2022 13:03,11/16/2021 0:00,,urn:uuid:f4cee23a-adf1-48fa-b74a-6e115c3f909b,http://test.adu.org.za/symbiota/collections/individual/index.php?occid=133769
134054,BOL,1,,Preserved specimen,,147694,147694,Plantae,Chlorophyta,Ulvophyceae,Ulvales,Ulvaceae,Ulva rhacodes,38439,(Holmes) Papenf.,Ulva,rhacodes,,,,,,,,,,"Bolton, J.J.",,,s.n.,,,,,,,,,,,,,,,,,,,0,,,,,,,South Africa,Western Cape,,,,Camps Bay,0,,-33.95,18.375,,,,,,,,,0,0,,,,,,,,,,,unprocessed,,admin,,8/5/2022 13:03,11/16/2021 0:00,,urn:uuid:130d2863-ad73-4425-98b5-dd740beb5c30,http://test.adu.org.za/symbiota/collections/individual/index.php?occid=134054
134057,BOL,1,,Preserved specimen,,147697,147697,Plantae,Chlorophyta,Ulvophyceae,Ulvales,Ulvaceae,Ulva rhacodes,38439,(Holmes) Papenf.,Ulva,rhacodes,,,,,,,,,,"Bolton, J.J.",,,s.n.,,,,,,,,,,,,,,,,,,,0,,,,,,,South Africa,Western Cape,,,,Camps Bay,0,,-33.95,18.375,,,,,,,,,0,0,,,,,,,,,,,unprocessed,,admin,,8/5/2022 13:03,11/16/2021 0:00,,urn:uuid:c1f4dc82-903b-4dad-9d2a-08ed17454e33,http://test.adu.org.za/symbiota/collections/individual/index.php?occid=134057
132912,BOL,1,,Preserved specimen,,146533,146533,Plantae,Chlorophyta,Ulvophyceae,Cladophorales,Cladophoraceae,Cladophora flagelliformis,37897,(Suhr) Kutz.,Cladophora,flagelliformis,,,,,,,,,,Paine,,,s.n.,,,,,,,,,,,,,,,,,,,0,,,,,,,South Africa,Western Cape,,,,Bachelor's Cave Camps Bay,0,,-33.93333,18.36667,,,,,,,,,0,0,,,,,,,,,,,unprocessed,,admin,,8/5/2022 13:03,11/16/2021 0:00,,urn:uuid:0e22cf24-3a06-42ed-80b0-794893a92758,http://test.adu.org.za/symbiota/collections/individual/index.php?occid=132912
127120,BOL,1,,Preserved specimen,127120,140721,140721,Plantae,Bryophyta,Bryopsida,Hypnales,Fabroniaceae,Fabronia wageri,37994,Dixon,Fabronia,wageri,,,,,,,,,,"Hedderson, T.A.J.",,,11744,1/3/1996,1996,1,3,,,,,ABUNDANT ON PLANTED TREES.,,,,,,,,,,0,,,,,,,South Africa,Western Cape,,,,"CAPE PEN., CAPE TOWN, RONDEBOSCH EAST. KROMBOOM RD.",0,,-33.93333,18.46667,,,,,,,,,0,0,,,,,,,,,,,unprocessed,,admin,,8/5/2022 13:03,8/5/2022 13:03,,urn:uuid:a2b36131-f197-43c1-ab9c-5eccfc1a255b,http://test.adu.org.za/symbiota/collections/individual/index.php?occid=127120
132374,BOL,1,,Preserved specimen,,145984,145984,Plantae,Chlorophyta,Ulvophyceae,Bryopsidales,Bryopsidaceae,Bryopsis pocockiae,116039,ms.,Bryopsis,pocockiae,,,,,,,,,,"Tyson, W.",,,s.n.,,,,,,,,,,,,,,,,,,,0,,,,,,,South Africa,Western Cape,,,,Sea Point,0,,-33.92,18.37833,,,,,,,,,0,0,,,,,,,,,,,unprocessed,,admin,,8/5/2022 13:03,11/16/2021 0:00,,urn:uuid:2f867368-9b7c-4ac1-8742-c05abbe2ffbe,http://test.adu.org.za/symbiota/collections/individual/index.php?occid=132374
